I,3920,1760,"24628805",山九昭安國際物流股份有限公司,桃園市,桃園市桃園區興邦路４３巷２號,"02-86772222",A,A,A,A,A,A,A,A,A,A
I,3920,1761,"34546819",尚興不織布股份有限公司,桃園市,桃園市龍潭區楊銅路１段１１８巷１５１號,"03-4116201",M,L,L,J,L,J,L,J,L,J
I,3920,1762,"03027931",三益實業股份有限公司,臺北巿,臺北巿中正區臨沂街３巷１號１樓,"02-23929515",L,M,L,M,L,M,L,M,L,M
I,3920,1763,"16554081",有緻科技有限公司,新北市,新北市淡水區民權路１７７巷６號,"02-28099415",L,L,L,L,L,L,L,L,L,L
I,3920,1764,"13111417",松瑞製藥股份有限公司南科分公司,臺南市,臺南市新市區臺南科學工業園區大順九路１１號,"06-5051200",F,A,I,A,A,A,B,A,C,A
I,3920,1765,"23167728",施耐德電機股份有限公司,臺北市,臺北市內湖區舊宗路二段１８９號５樓,"02-66111000",A,M,A,L,A,L,A,L,A,L
I,3920,1766,"16130319",科學城物流股份有限公司,臺南市,臺南市新市區臺南科學工業園區大業一路８號,"06-5051655-605",A,L,A,D,A,I,A,F,A,F
I,3920,1767,"23526772",台灣迪恩士半導體科技股份有限公司,新竹市,新竹市東區高翠路３１１號　,"03-5631066",A,L,A,L,A,L,A,L,A,L
I,3920,1768,"53680511",翔達光電股份有限公司,新北市,新北市新莊區福營路３２６號１０樓,"02-29908338",M,M,L,M,L,L,L,M,L,M
I,3920,1769,"83967169",實家企業社,台南市,台南市北區北成路３００號１樓,"06-2834130",L,M,L,M,L,L,L,L,K,L
I,3920,1770,"31300690",王佳實業股份有限公司,桃園市,桃園市桃園區經國路８８８號１４樓之２,"03-3265522",K,F,J,A,J,A,J,A,J,A
I,3920,1771,"23060459",台灣希悅爾股份有限公司,臺北市,臺北市內湖區內湖路１段３００號３樓之５,"02-81786999",H,M,C,L,B,M,A,M,C,M
I,3920,1772,"12921868",凱爾包裝材料有限公司,臺南市,臺南市新營區新嘉街３號,"06-6520282",L,L,L,L,K,L,K,L,L,L
I,3920,1773,"89941949",仕全實業有限公司,新北市,新北市鶯歌區國慶街１５０號１樓,"02-26776622",L,M,L,M,L,M,L,M,L,M
I,3920,1774,"23778208",四季紙品禮品有限公司,新北市,新北市中和區建康路二之二號一之四樓,"22231019",L,L,L,K,L,K,L,L,L,L
I,3920,1775,"16144545",晶邦科技股份有限公司,新北市,新北市汐止區新台五路１段９７號２５樓之６,"02-26975899",L,L,L,L,L,L,L,L,L,L
I,3920,1776,"16877131",韋僑科技股份有限公司,臺中市,臺中市大里區仁化里工業九路１號２樓,"04-24925298",J,A,I,A,I,A,J,A,I,A
I,3920,1777,"81039244",聖志企業有限公司,臺北巿,臺北巿中山區龍江路二四三巷一一號一樓,"02-25035353",L,M,K,M,K,M,K,M,J,M
I,3920,1778,"70680487",信康企業股份有限公司,新北市,新北市新莊區五工五路９號１樓,"02-22995188",L,L,L,K,L,J,L,J,L,L
I,3920,1779,"84234002",信佳凡而有限公司,新北市,新北市八里區博物館路１９５號,"02-26194559",L,L,L,L,L,L,L,L,L,M
I,3920,1780,"33692089",世佳電器股份有限公司,新北市,新北市新莊區民安路３８７巷三十四號,"02-22040191",K,I,I,F,H,D,H,D,H,E
I,3920,1781,"86462297",成高有限公司,高雄市,高雄市前金區長生街６號９樓,"07-8312303",L,M,K,M,L,L,L,M,L,M
I,3920,1782,"27954556",台灣積水化學股份有限公司,台北市,台北市中山區南京東路２段２號１０樓,"02-25235335",I,J,C,G,A,G,C,F,E,E
I,3920,1783,"23618717",矽菱企業股份有限公司,新竹縣,新竹縣竹北市台元一街５號２樓之１６　　,"03-5601066",I,L,E,L,E,L,G,L,F,L
I,3920,1784,"23450908",水興實業股份有限公司,桃園市,桃園市龜山區東萬壽路６４２巷７４、７６號,"03-3498841",J,K,G,I,C,G,E,D,G,G
I,3920,1785,"68682185",森田印刷廠股份有限公司,臺南市,臺南市安南區科技五路８５號,"06-3842811",I,A,F,A,C,A,C,A,E,A
I,3920,1786,"16226948",森業實業有限公司,桃園市,桃園市龜山區忠義路２段２６０巷５９號１樓,"03-3282588",L,M,L,M,L,M,L,M,L,M
I,3920,1787,"89737622",薪鼎企業有限公司,彰化縣,彰化縣大村鄉平和村中山路３段２巷４１２號,"04-8523088",L,M,L,L,L,L,L,M,L,L
I,3920,1788,"70848937",日商千住金屬工業股份有限公司高雄分公司,高雄市,高雄市前鎮區新生路２４８之２４、之２６、之３３、之３５、之３７號５樓,"07-3985201",G,L,A,I,A,H,B,H,B,H
I,3920,1789,"22013394",先迪利有限公司,臺北市,臺北市松山區南京東路5段84號2樓,"02-29110760",L,L,J,L,L,M,L,M,L,M
I,3920,1790,"86690573",中磊電子股份有限公司,臺北市,臺北市南港區園區街３之１號８樓,"02-26553988",A,A,A,A,A,A,A,A,A,A
I,3920,1791,"55791267",斯力歐科技有限公司,臺北市,臺北市中山區中山北路1段152號6樓,"02-2521-3908",L,M,L,M,L,L,M,M,M,M
I,3920,1792,"28785452",艾思科技股份有限公司,臺中市,臺中市潭子區潭子街３段公廳巷６９號３樓,"04-25375672",L,L,K,J,L,L,K,K,J,J
I,3920,1793,"23928467",台灣檢驗科技股份有限公司,新北市,新北市五股區五股工業區五工路１３６之１號,"02-22993279-2211",J,L,H,L,I,L,J,L,J,L
I,3920,1794,"29186265",台灣興勝半導體材料股份有限公司,高雄市,高雄市楠梓加工區東七街１６號,"07-3653592",A,E,A,A,A,A,A,A,A,A
I,3920,1795,"97387850",沙宣企業有限公司,台中巿,台中巿西屯區西屯路２段２９７之８巷１２弄３８號１樓,"04-24210136",L,M,L,M,L,M,L,M,L,M
I,3920,1796,"27851496",山欣聯合實業有限公司,新北市,新北市泰山區泰林路二段５２２巷４２號９樓,"02-29091990",L,M,L,M,L,M,L,M,M,M
I,3920,1797,"28356380",上佶銘股份有限公司,桃園市,桃園市蘆竹區錦中村錦順街３９號,"03-3121288",L,M,L,L,K,L,L,L,L,M
I,3920,1798,"86400595",尚謀實業股份有限公司,彰化縣,彰化縣彰化巿中央路１８６之６號,"04-7631438",L,L,K,M,K,M,K,L,K,L
I,3920,1799,"12803742",上右宏企業有限公司,嘉義縣,嘉義縣民雄鄉山中村１５鄰牛斗山１６７號,"05-2214920",L,M,L,M,L,M,L,M,L,M
I,3920,1800,"89310719",紹崴有限公司,新北市,新北市中和區連城路６５巷５之２號３樓,"02-26089186",L,M,L,M,K,M,K,L,K,L
I,3920,1801,"53926016",慶陽國際有限公司,臺北市,臺北市內湖區瑞光路６０７號４樓,"02-77213366",L,M,L,L,L,L,K,L,L,L
I,3920,1802,"53430612",世華建材有限公司,新北市,新北市永和區永和路２段２３３號１３樓之７　,"02-27989558#24",L,M,L,M,L,M,L,M,L,M
I,3920,1803,"86786922",興楙實業股份有限公司,新北市,新北市板橋區萬安街１０３巷７號１樓,"02-29554325",M,M,L,M,L,M,L,M,L,L
I,3920,1804,"69773590",水工社企業有限公司,臺南巿,臺南巿東區仁和里仁和路１３９巷６１號２樓,"06-2676978",M,M,L,L,L,M,L,L,L,K
I,3920,1805,"22460962",盛詮印刷股份有限公司,新北市,新北市中和區立德街七巷一一號,"02-22231234",J,L,H,L,J,L,J,L,L,L
I,3920,1806,"27505469",盛臨興業有限公司,臺中市,臺中市烏日區大同五街１８號１樓,"04-23366429",L,M,L,M,L,M,L,M,L,M
I,3920,1807,"24961267",勝全家飾有限公司,臺北市,臺北市士林區華榮街８號,"02-85316223",L,M,K,M,M,M,M,M,M,M
I,3920,1808,"53048849",聖久鼎實業有限公司,臺中市,臺中市大肚區成功里文昌路三段１６２巷１０７弄３８號,"04-26994942",L,M,L,M,L,M,M,M,M,M
I,3920,1809,"84536392",盛榮興業有限公司,雲林縣,雲林縣古坑鄉光華路５１號,"05-5825042",L,M,L,M,L,M,K,M,K,M
I,3920,1810,"04662255",昇亞股份有限公司,台北巿,台北巿信義區松德路１７１號７樓之７,"02-27599188",K,L,J,L,J,L,J,L,J,L
I,3920,1811,"70499157",盛隆國際工程事業有限公司,臺北市,臺北市信義區基隆路二段１１５號１１樓,"02-87327555",L,M,L,M,M,M,L,M,M,M
I,3920,1812,"16453099",勝胤企業有限公司,高雄市,高雄市湖內區中山路１段７０５之１號,"07-6320327",K,J,J,K,L,M,M,M,M,M
I,3920,1813,"12613412",住重電子機械科技股份有限公司,新北市,新北市三重區重新路３段８１號１樓,"02-2987-7071",J,M,K,M,K,M,J,L,L,M
I,3920,1814,"53138721",台灣住重離子科技股份有限公司　,新竹市,新竹市東區埔頂路２５號５樓之１,"03-6668161",H,M,E,L,E,L,G,L,G,L
I,3920,1815,"85061490",世湸材料科技有限公司,臺南市,臺南市新市區港墘里長安街36巷37號5樓之2,"0910-391045",M,M,L,M
I,3920,1816,"28343724",資生國際有限公司,臺中市,臺中市西屯區福聯里福科路９６１巷２０號１樓,"04-24612266",J,M,I,L,J,M,J,M,J,M
I,3920,1817,"64896242",上嘉科技有限公司,臺南市,臺南市南區大恩里國民路１０１號１樓,"06-2899199",L,M,L,M,L,M,M,M,M,M
I,3920,1818,"54628991",享樂客國際有限公司,高雄市,高雄市三民區禮明路９３巷２９號１樓,"07-3552488",M,M,L,J,M,H,L,H,L,I
I,3920,1819,"20697701",興盛鐵工廠股份有限公司,台北巿,台北巿南京東路五段２８６巷３號３樓,"02-2767-6996",L,K,L,I,L,H,L,I,L,J
I,3920,1820,"72138686",旭振工業股份有限公司,臺南市,臺南市安定區中沙里中崙１５８號,"06-5930858-9",L,L,L,L,L,L,L,L,L,L
I,3920,1821,"47255236",十全特好食品股份有限公司,新竹縣,新竹縣竹北市崇義里鳳岡路３段３９８號,"03-5561-666",L,L,J,L,K,K,K,K,K,K
I,3920,1822,"11039306",士林電機廠股份有限公司,台北巿,台北巿中山北路６段８８號１６樓,"02-2834-2662",A,A,A,A,A,A,A,A,A,A
I,3920,1823,"80571163",尚錞實業股份有限公司,彰化縣,彰化縣彰化市崙平里平和一街４７號,"",L,M,L,M,L,M,L,M,L,M
I,3920,1824,"53390999",囍綠休閒開發有限公司,桃園市,桃園市桃園區同安里同德一街３號１樓,"03-4616412",M,M,L,M,L,M,L,M,L,M
I,3920,1825,"54178475",台灣島津科學儀器股份有限公司,臺北市,臺北市信義區東興路３７號１１樓,"02-87681880",G,M,B,M,A,M,B,L,C,L
I,3920,1826,"24276554",順邦國際有限公司,臺南市,臺南市南區新義南路３號,"06-2718589",L,M,K,M,L,M,L,L,K,L
I,3920,1827,"86548605",新國芳企業股份有限公司,嘉義縣,嘉義縣朴子市竹村里工業區三街四號,"05-3693691",L,M,L,M,L,M,L,M,L,M
I,3920,1828,"79993432",新連明條碼科技有限公司,彰化縣,彰化縣大村鄉大智路二段４１號,"04-8531483",L,L,L,L,L,L,L,L,L,M
I,3920,1829,"16511106",鑫立得興業股份有限公司,台中巿,台中巿西區民龍里日盛街１９號１樓,"04-7321779",C,M,A,M,A,L,B,M,F,M
I,3920,1830,"12828053",興普科技股份有限公司,桃園市,桃園市蘆竹區內厝村內溪路４７號,"03-3249990",L,J,K,G,J,G,J,F,J,F
I,3920,1831,"28181306",新輝光電股份有限公司,苗栗縣,苗栗縣竹南鎮新竹科學工業園區科研路５８號,"02-25071251",L,K,K,K,J,J,J,I,J,I
I,3920,1832,"23489235",晉吉股份有限公司,嘉義縣,嘉義縣民雄鄉建國路二段一一二︱一號,"05-2216123",L,L,L,J,L,J,L,J,L,J
I,3920,1833,"16338090",祥賀包裝材料有限公司,臺中市,臺中市東區十甲路２７６號１樓,"04-22111588",L,M,L,M,L,M,L,M,L,M
I,3920,1834,"22726689",祥發運動設施管理有限公司,新北市,新北市板橋區明德街１巷１之１號２樓,"02-22265008",L,M,L,M,L,M,L,M,L,M
I,3920,1835,"22311318",新弘股份有限公司,台中巿,台中巿東區旱溪五街１１之１號,"049-2328458#207",K,L,J,K,J,L,K,L,K,L
I,3920,1836,"80570988",迅嘉電子股份有限公司,桃園市,桃園市蘆竹區內厝村南山路２段３０３號,"03-3246866",L,G,L,B,K,B,L,C,L,D
I,3920,1837,"86099993",升望科技股份有限公司,新北市,新北市五股區五工二路１１６巷２２號,"02-22900966",L,J,L,I,L,H,L,G,L,H
I,3920,1838,"24528313",新光今井貿易股份有限公司,高雄市,高雄市苓雅區新光路３８號２６樓之２,"07-5367110",L,L,L,J,L,K,L,J,L,K
I,3920,1839,"33122166",杏林新生製藥股份有限公司,桃園市,桃園市龍潭區三和里店湖一路２３７號,"02-27001414",L,L,L,L,K,L,K,L,K,L
I,3920,1840,"24745613",昕福企業有限公司,臺北市,臺北市大安區和平東路２段１１８巷５２弄１７號,"02-27325127",L,M,L,M,L,M,L,M,L,M
I,3920,1841,"42759265",台灣新生紙業股份有限公司,桃園市,桃園市中壢區中央西路二段２７０號４樓,"03-2812332",L,L,L,L,L,L,L,L,L,L
I,3920,1842,"16515948",易如企業有限公司,新北市,新北市淡水區中正路１１之８號,"02-26201425",L,L,L,L,L,L,L,L,L,L
I,3920,1843,"28063103",順一國際有限公司,新北市,新北市汐止區橫科路２１巷７弄３號４樓,"86014675",L,M,L,M,L,M,L,M,L,M
I,3920,1844,"34182057",生宇企業股份有限公司,新北市,新北市中和區錦和路一二六號,"02-22239090",L,L,L,K,L,K,L,K,L,K
I,3920,1845,"24240796",全舜光學科技有限公司,臺南市,臺南市永康區中正三街１２９號,"06-2538136",L,L,L,K,L,K,L,L,L,L
I,3920,1846,"42634337",夏爾光譜股份有限公司,臺北市,臺北市內湖區洲子街６３號６樓,"02-87523878",L,L,L,L,L,L,L,M,L,M
I,3920,1847,"27649439",旭立科技股份有限公司,桃園市,桃園市八德區永豐路４３５號,"03-3788588",L,I,J,G,J,I,J,J,K,J
I,3920,1848,"35990393",旭振有限公司,新北市,新北市三重區環河南路２５４巷１１０號２樓,"02-29768960",L,L,L,L,L,L,L,L,L,L
I,3920,1849,"42883308",職人包裝有限公司,臺中市,臺中市西屯區惠來里市政南一路98號2樓之1,"04-22536666",L,M,L,M,L,M,L,M,L,M
I,3920,1850,"27574325",尚發國際有限公司,台北市,台北市中山區八德路２段３１８號４樓,"02-27216129",C,M,A,M,A,M,A,M,A,M
I,3920,1851,"36056273",烜毅實業有限公司,臺北市,臺北市大同區承德路２段２１５號７樓之４,"02-25571429",L,M,L,M,L,M,L,M,L,M
I,3920,1852,"23148363",樹森開發股份有限公司,臺北巿,臺北巿信義區忠孝東路５段５１０號１３樓,"02-27924000",A,M,A,M,A,M,A,M,A,M
I,3920,1853,"53042710",上渼塑膠有限公司,臺中市,臺中市清水區中山路５３９之２９號１樓　,"04-26235522",L,M,L,M,L,M,M,M,M,M
I,3920,1854,"42713825",順發成國際開發有限公司　,高雄市,高雄市苓雅區四維四路１９９號１２樓,"07-2692312",M,M,L,M,M,J,M,K,M,M
I,3920,1855,"20980880",浩鑫股份有限公司,臺北巿,臺北巿內湖區瑞光路７６巷３０號５樓,"02-87926168",K,K,I,J,K,K,J,L,J,J
I,3920,1856,"33003400",祥駿紙工業有限公司,臺北巿,臺北巿士林區士商路６８號２樓,"02-29668148-9",K,M,J,M,I,M,I,M,I,M
I,3920,1857,"54348345",翔俐國際有限公司,臺北市,臺北市松山區南京東路４段５０號５樓之３　,"02-26021782",J,M,I,M,I,M,J,M,J,L
I,3920,1858,"13032342",翔俐建材有限公司,新北市,新北市八里區忠八街９號,"02-26021782",L,M,J,M,J,M,K,M,L,M
I,3920,1859,"89852349",劦資木業有限公司,臺中巿,臺中巿大安區中山南路８０２巷１５號,"04-26715500",L,M,L,L,L,M,L,M,L,M
I,3920,1860,"16666109",矽卡有限公司,桃園市,桃園市蘆竹區坑口村大有街９巷１２號,"03-3543828",L,H,L,C,L,D,K,C,K,E
I,3920,1861,"84306146",台灣西克股份有限公司,臺北巿,臺北巿中正區中華路１段３９號２０樓,"02-23756288",G,M,D,M,B,L,C,M,D,M
I,3920,1862,"51304006",澳商西門子歌美颯再生能源股份有限公司台灣分公司,臺北市,臺北市中山區松江路１２６號８樓之１,"02-77473400",M,M,H,M,L,M,L,M,M,M
I,3920,1863,"80169303",西河科技股份有限公司,臺北市,臺北市大同區民權西路１０４號７樓之１,"02-77091700",J,M,G,M,G,M,H,M,G,M
I,3920,1864,"33886753",聯和醫療器材股份有限公司,新北市,新北市瑞芳區頂坪路３４號,"02-24974121",I,I,E,E,G,D,F,A,E,A
I,3920,1865,"53677261",荷蘭商希諾德有限公司台灣分公司,臺中市,臺中市南屯區大墩十一街３３８號７樓之２　,"04-22555905",L,L,J,L,J,L,J,L,J,L
I,3920,1866,"54073084",巳國有限公司,臺南市,臺南市安南區理安街１０９號１樓,"0918012595",L,L,K,L,L,L,L,L,L,L
I,3920,1867,"28349065",聖脈國際有限公司,桃園市,桃園市桃園區大興西路二段２６之９號９樓,"03-2288-560",L,L,K,L,K,L,L,L,L,L
I,3920,1868,"13128986",台灣西卡股份有限公司,桃園市,桃園市蘆竹區富國路３段１３８０號,"03-352-8622",H,L,A,M,A,L,A,L,A,L
I,3920,1869,"53437761",喜麗康有限公司,新北市,新北市五股區五權六路１１號,"02-26030319",M,M,L,M,L,M,L,M,L,M
I,3920,1870,"22099202",矽統科技股份有限公司,新竹市,新竹市公道五路２段１８０號,"03-5166000",L,K,J,H,I,H,K,G,L,H
I,3920,1871,"42847872",矽芯有限公司,新竹市,新竹市東區東美路９１巷３號,"",L,L,K,L,K,L,L,L,M,M
I,3920,1872,"55991080",矽品精密工業股份有限公司,臺中市,臺中市潭子區大豐里大豐路三段１２３號,"04-25341525",A,A,A,A,A,A,A,A,A,A
I,3920,1873,"16130839",矽品精密工業股份有限公司新竹分公司,新竹科,新竹科學工業園區新竹縣寶山鄉研發二路１之１號,"03-5787799#3222",A,A,A,A,A,A,A,A,A,A
I,3920,1874,"23149026",德荃企業股份有限公司,台北巿,台北巿大安區復興南路一段二０五號一樓,"02-27526152",L,M,J,M,J,M,J,M,I,M
I,3920,1875,"81199261",水森企業有限公司,高雄市,高雄市鳳山區輜汽路１６號,"07-7517106",L,J,L,H,L,F,L,F,L,H
I,3920,1876,"89517556",相同企業有限公司,臺中市,臺中市烏日區前竹里光明路１６２巷９０號１樓,"04-23352827",L,L,L,L,L,L,L,L,M,L
I,3920,1877,"28126557",鑫立誠企業有限公司,臺南市,臺南市永康區永平街２９８巷１５之３號,"06-2034913",L,M,L,M,L,M,L,M,L,M
I,3920,1878,"88178677",信盛精工股份有限公司,高雄市,高雄市岡山區潭底里潭底路３０１號,"07-6283172",J,F,F,A,F,A,F,A,G,A
I,3920,1879,"22914155",信億塑膠有限公司,彰化縣,彰化縣秀水鄉鶴鳴村馬鳴路５５號,"04-7698362",M,M,L,M,L,M,L,M,L,M
I,3920,1880,"23542766",信邦電子股份有限公司,苗栗縣,苗栗縣苗栗巿國華路５８２號,"037330099",A,A,A,A,A,A,A,A,C,A
I,3920,1881,"53296925",誠鋒興業股份有限公司,臺中市,臺中市大雅區前村路１２８號,"04-25653836",L,K,L,J,L,J,L,J,L,J
I,3920,1882,"97263289",欣吉利實業股份有限公司,臺南巿,臺南巿仁德區大順路３０號,"06-2059858",L,M,L,M,L,L,L,L,M,L
I,3920,1883,"28405185",欣多利有限公司,苗栗縣,苗栗縣頭份鎮民生里新生街７號,"037-581333",L,K,L,J,L,J,L,J,L,K
I,3920,1884,"28215381",新思國際股份有限公司,臺北市,臺北市松山區八德路三段２號１２樓之２,"02-25771089",L,M,J,M,K,M,L,L,L,M
I,3920,1885,"89292037",新綸實業有限公司,桃園市,桃園市蘆竹區南山路一段438號5樓,"03-3218800",L,L,K,L,K,L,J,L,K,L
I,3920,1886,"43949476",新航保麗龍股份有限公司,桃園市,桃園市楊梅區中山南路８００巷９８弄６號,"03-4756168",L,L,K,M,L,M,L,L,L,M
I,3920,1887,"54964001",新加坡商海底撈國際食品有限公司台灣分公司,臺北市,臺北市信義區基隆路二段１５號１１樓,"09-78088701",J,L,J,L,M,M,M,M,M,M
I,3920,1888,"86390506",新灃企業股份有限公司,嘉義縣,嘉義縣朴子市大葛里大槺榔７５之１號,"05-3790089",K,J,J,E,J,D,J,B,J,C
I,3920,1889,"23282425",興采實業股份有限公司,新北市,新北市新莊區五權二路１０號１樓,"02-85127888",L,A,L,A,L,A,L,A,J,A
I,3920,1890,"42042734",杏輝藥品工業股份有限公司,宜蘭縣,宜蘭縣冬山鄉中山村中山路８４號,"02-27603688",H,H,E,E,E,F,G,G,F,H
I,3920,1891,"28580090",新順興業股份有限公司,臺中市,臺中市北屯區崇德六路１９巷２２號,"04-22398808",M,M,L,M,M,M,M,M,M,M
I,3920,1892,"86078527",鑫達懋業股份有限公司,臺中市,臺中市南屯區精科五路３８號２樓,"04-23503145",K,L,J,L,H,L,I,L,J,L
I,3920,1893,"52593736",鮮京電子材料股份有限公司,臺北市,臺北市信義區基隆路１段４３２號１０樓之５　,"02-55511266",L,L,L,L,L,L,L,L,M,M
I,3920,1894,"80400345",有力事業有限公司,臺中市,臺中市神岡區溪頭路２號,"04-25620899",L,K,L,I,L,J,M,M,M,M
I,3920,1895,"22635246",翰可國際股份有限公司,台北市,台北市內湖區瑞光路２５８巷２號６樓之２,"02-2658-8229",J,H,I,E,D,F,J,H,G,G
I,3920,1896,"84317621",天印科技有限公司,高雄市,高雄市仁武區鳳仁路２８７－７號,"07-3733000",M,M,L,M,L,M,L,M,L,M
I,3920,1897,"70748748",英屬維京群島商李肇勳國際室內設計顧問股份有限公司,臺北市,臺北市中山區復興北路４２０號５樓,"02-25180555",J,M,L,M,L,M,J,M,L,M
I,3920,1898,"80258993",智慧光科技股份有限公司,基隆市,基隆市七堵區工建路２之１號,"02-24525100",J,E,I,A,I,C,H,A,J,D
I,3920,1899,"43372402",昶曜科技股份有限公司,新北市,新北市新莊區中正路５４２號之１６號３樓,"02-29080296",L,M,L,L,L,L,L,L,L,M
I,3920,1900,"50872424",樂在琪中國際有限公司,臺北市,臺北市中山區新生北路２段１２７巷１之１號,"02-25638098",L,M,L,M,L,M,M,M,M,M
I,3920,1901,"66559765",翔塑實業有限公司,新北市,新北市深坑區北深路３段１５５巷１號７樓,"02-86626501",L,M,L,M,L,M,L,M,M,M
I,3920,1902,"23930843",雙詠企業股份有限公司,臺北巿,臺北巿中山區民生東路２段１７４號５樓,"02-25160737",L,M,L,M,L,M,L,M,L,M
I,3920,1903,"43787872",光洋應用材料科技股份有限公司,臺南市,臺南市安南區工業三路１號　　　　,"06-5110123",A,A,A,A,A,A,A,A,A,A
I,3920,1904,"97500966",好加企業股份有限公司,臺中市,臺中市太平區光興路１７７８巷１８、２２號,"04-22704765",L,J,K,I,L,J,K,I,K,I
I,3920,1905,"23295505",台灣舒絡德科技股份有限公司,新北市,新北市新莊區五權一路３號之２,"02-22982760",L,L,L,L,L,L,L,L,L,L
I,3920,1906,"24808757",英屬維京群島商方案三三股份有限公司台灣分公司,新北市,新北市板橋區忠孝路２６１號３樓,"02-29630433#51",L,J,L,G,L,I,J,I,I,H
I,3920,1907,"16071260",碩茂合纖膠帶有限公司,桃園市,桃園市龜山區嶺頂里萬壽路２段４１０巷１號,"03-3201221",M,L,L,L,L,L,L,L,L,L
I,3920,1908,"03193109",秀山交通器材股份有限公司,新北市,新北市板橋區文化路２段４２７號,"02-22521011",L,A,K,A,K,A,K,A,L,A
I,3920,1909,"96980122",嵩雷精密工業股份有限公司,新北市,新北市汐止區和平街四八號四樓,"02-28570667",L,M,L,M,L,L,L,M,K,M
I,3920,1910,"85010916",松茂船舶有限公司,高雄市,高雄市鼓山區鼓山一路53之12號1樓,"07-5318675",L,M,L,M,M,M,M,M,M,M
I,3920,1911,"80421587",松欣美有限公司,新北市,新北市土城區中華路一段７０巷２３號,"02-2273-6338",M,L,L,L,M,L,M,L,M,L
I,3920,1912,"28958735",靖展國際有限公司,桃園市,桃園市桃園區大有路１７３號１４樓,"03-3314330",J,L,G,L,G,L,E,L,K,L
I,3920,1913,"23529362",台灣索尼股份有限公司,臺北市,臺北市中山區中山北路２段４２號５樓,"02-25228545",A,A,A,A,A,A,A,A,A,A
I,3920,1914,"97128876",碩普企業有限公司,臺北巿,臺北巿北投區尊賢街二二０號三樓,"02-28279135",M,M,L,M,L,M,L,M,L,M
I,3920,1915,"24392673",宇葳科技股份有限公司,桃園市,桃園市中壢區青埔九街８８號,"03-2870606",L,M,M,M,M,M,L,L,L,L
I,3920,1916,"86496439",上德設計工程股份有限公司,台北巿,台北巿中山北路５段８４２號４樓,"88666801",L,M,L,L,L,L,L,L,L,L
I,3920,1917,"12146000",華王貿易有限公司,臺北市,臺北市松山區復興北路３６９號８樓之７,"02-27131133",K,K,J,I,I,J,I,K,I,L
I,3920,1918,"36551288",敬洋股份有限公司,新北市,新北市新店區民權路９５號１０樓,"02-22180195",K,K,H,H,I,G,H,E,H,F
I,3920,1919,"80463896",鼎聯科技股份有限公司,苗栗縣,苗栗縣竹南鎮公義路８６１之１號,"037-585647",L,M,L,L,L,L,L,L,L,L
I,3920,1920,"28727361",思邦科技股份有限公司,臺中市,臺中市北區進化北路２３８號１４樓之３,"04-22376797",L,M,L,M,L,M,L,M,L,M
I,3920,1921,"97384896",春穀企業有限公司,臺南市,臺南市新營區新東里１６鄰東智街４６巷３號１樓,"06-6842195",K,M,J,M,K,M,J,M,K,M
I,3920,1922,"86572463",永桓有限公司,南投縣,南投縣南投市中華路２７１號１樓,"049-2264720",L,M,L,L,L,L,L,L,L,L
I,3920,1923,"42755556",住微科技有限公司,新竹市,新竹市公道五路二段１２０號１０樓之１　　,"",L,M,L,L,L,M,K,M,L,M
I,3920,1924,"22195654",精華光學股份有限公司,新北市,新北市汐止區大同路１段２７６之２號４、５樓,"02-8691-6000",L,A,L,A,J,A,I,A,L,A
I,3920,1925,"70848970",昱龍不銹鋼股份有限公司中港分公司,臺中市,臺中市梧棲區草湳里經一路５３號,"04-26595179",J,J,I,E,H,G,I,F,H,H
I,3920,1926,"28339643",江楠企業有限公司,臺中市,臺中市大肚區王田里興和路２１１號１樓,"04-26930033",L,M,L,M,L,M,L,M,L,M
I,3920,1927,"30958009",登威股份有限公司,台北巿,台北巿中山區建國北路二段１９０號７樓之１,"02-25150510",L,H,J,C,H,E,I,E,H,F
I,3920,1928,"12606952",思達科技股份有限公司,新竹市,新竹市公道五路二段101號2樓之1,"03-5717179",G,I,A,A,A,A,A,C,A,E
I,3920,1929,"22318781",中日龍股份有限公司,臺北巿,臺北巿士林區中正路１２０號７樓,"02-28346295",L,L,K,L,K,L,K,L,L,L
I,3920,1930,"30896187",星裕國際股份有限公司,台北巿,台北巿內湖區基湖路３巷４７號８樓,"02-8751-5235",A,M,A,L,A,L,A,M,A,L
I,3920,1931,"24811269",塞席爾商斯達富股份有限公司台灣分公司,臺中市,臺中市南屯區精科東路９號,"04-23550669",M,L,H,E,L,L,L,M,M,M
I,3920,1932,"23511383",步展企業股份有限公司,高雄市,高雄市岡山區岡山路三四九之一號,"07-6220803",L,L,K,L,K,L,L,K,L,K
I,3920,1933,"24690899",欣德芮股份有限公司,基隆市,基隆市七堵區大華二路３３之７號,"02-24555498",I,I,H,F,H,G,I,I,J,K
