I,3920,1233,"22853875",康勝企業股份有限公司,台北市,台北市信義區光復南路４９５號６樓之３,"(02)2909-0960",H,L,D,K,G,K,H,K,H,K
I,3920,1234,"53981663",光陽精密有限公司,臺中市,臺中市北區忠明路２１１號９樓之５,"04-22083518",L,M,L,M,K,M,K,L,L,L
I,3920,1235,"22470814",奇裕企業股份有限公司,臺北巿,臺北巿松山區南京東路五段三五六號一二樓之一,"02-27686966",K,L,J,L,J,K,I,L,J,I
I,3920,1236,"53582639",凱勝國際有限公司,高雄市,高雄市大寮區中庄里崇明街１８號１樓,"07-7021520",L,M,L,M,L,M,L,M,L,M
I,3920,1237,"16428959",冠閣有限公司,　桃園,　桃園市桃園區春日路１４３４巷８７號１、３樓，８９號３樓,"03-3267890",L,M,L,M,M,M,M,M,M,M
I,3920,1238,"29581218",光華鋁箔有限公司,桃園市,桃園市蘆竹區南崁路２段２００號２樓,"03-3217789",M,L,L,L,L,L,L,L,L,L
I,3920,1239,"51272200",光榮工業股份有限公司,臺中市,臺中市大里區健民里仁化路２１５號,"04-24916181",K,E,H,A,G,A,H,A,G,A
I,3920,1240,"23952986",貴臺企業有限公司,嘉義市,嘉義市荖藤里荖藤宅５８號１樓,"",L,L,K,K,L,K,K,J,K,K
I,3920,1241,"84552420",昆弘實業股份有限公司,彰化縣,彰化縣秀水鄉福陵路１２８巷５１號,"04-7695688",L,M,L,L,M,L,M,M,M,M
I,3920,1242,"27265159",坤家有限公司,高雄市,高雄市鳳山區南一街７１巷７號１樓,"07-7336620",L,M,L,M,L,M,L,M,L,M
I,3920,1243,"86198804",坤捷企業有限公司,南投縣,南投縣埔里鎮信義路２９９號１樓,"049-2987779",K,L,K,M,K,M,J,L,J,K
I,3920,1244,"12848641",崑溢企業有限公司,桃園市,桃園市八德區大正里正福五街６８號１４樓,"03-3647945",L,M,L,L,L,M,L,M,L,M
I,3920,1245,"61809650",玖賀企業有限公司,臺中市,臺中市東區東光園路２８２號１樓,"0928-826675",L,M,L,M,L,M,L,M,M,M
I,3920,1246,"70405118",庫力索法股份有限公司,高雄市,高雄市前鎮區新都路1號5樓,"07-2200800",E,L,A,L,A,L,A,M,A,M
I,3920,1247,"53890740",昆承電子材料有限公司,高雄市,高雄市岡山區為隨西路６７巷３３號,"07-6231181",L,L,J,K,J,K,J,K,J,K
I,3920,1248,"97507784",坤隆行實業股份有限公司,臺中市,臺中市大里區工業１４路３８號,"04-22711234",K,J,J,G,I,E,H,D,L,J
I,3920,1249,"12267209",國住橡膠股份有限公司,臺北巿,臺北巿中山區松江路３６３號５樓,"02-25012847",B,L,A,L,A,L,A,L,A,M
I,3920,1250,"84822542",高尼安笙企業股份有限公司,桃園市,桃園市中壢區東園路６７號,"03-4516988",L,L,K,L,J,L,J,L,J,L
I,3920,1251,"07291518",冠球股份有限公司,桃園市,桃園市楊梅區新江路２０２號,"03-4781151",J,H,I,C,G,A,G,B,G,B
I,3920,1252,"27320218",寬和印刷器材有限公司,臺北市,臺北市萬華區環河南路３段２６５號３樓,"02-23078205",L,M,L,M,L,M,L,M,M,M
I,3920,1253,"16079734",固笙企業有限公司,新北市,新北市中和區建八路２號２樓之１,"02-8226-1122",L,M,L,L,L,L,L,L,L,M
I,3920,1254,"70812945",京元電子股份有限公司竹南分公司,苗栗縣,苗栗縣竹南鎮頂埔里中華路１１８號,"037-595666",A,A,A,A,A,A,A,A,A,A
I,3920,1255,"53921238",活力京都有限公司,臺北市,臺北市信義區基隆路２段５１號１４樓,"02-27369588",L,L,L,L,L,M,L,M,L,M
I,3920,1256,"97160592",玖長軸承工業股份有限公司,高雄市,高雄市路竹區順安路２７５巷１５０號,"07-6977058",J,H,H,A,H,A,H,A,H,B
I,3920,1257,"89482141",頡陞有限公司,台北巿,台北巿文山區木柵路一段三二三之三號三樓　　　　　　　,"02-29363351",L,M,L,M,K,M,K,M,L,M
I,3920,1258,"31118237",禮學社股份有限公司,新北市,新北市中和區連城路２３２之１號３樓,"02-66205988",L,L,L,K,L,L,L,K,L,K
I,3920,1259,"96956410",萊爾德電子材料股份有限公司,新北市,新北市五股區五權六路２２號,"02-22901234",J,I,H,F,G,G,I,G,I,G
I,3920,1260,"01355248",徠善貿易有限公司,台北巿,台北巿松山區南京東路四段１９７號９樓,"27151515",L,M,L,L,L,L,L,L,L,L
I,3920,1261,"84897212",香港商科林科技有限公司台灣分公司,新竹市,新竹市東區公道五路三段１號８樓之１、２,"03-5798666",A,L,A,M,A,L,A,L,A,L
I,3920,1262,"86616906",藍諠實業有限公司,新北市,新北市新莊區雙鳳路７號,"02-2209-2207",L,K,L,J,L,J,L,J,L,J
I,3920,1263,"23253414",良瑞科技股份有限公司,新北市,新北市鶯歌區建國路５７０號２、３樓,"02-26787966",L,L,K,L,L,L,L,K,K,K
I,3920,1264,"22353766",聯盈電子股份有限公司,臺北巿,臺北巿內湖區南京東路６段３３０巷１８弄２號３樓,"02-27923756",K,I,I,F,J,E,J,E,J,F
I,3920,1265,"05064811",聯郵企業股份有限公司,臺北市,臺北市內湖區洲子街１９６號４樓,"02-26271255",L,L,K,K,L,L,L,L,L,L
I,3920,1266,"31100969",老昌企業有限公司,台北市,台北市士林區小西街６３號１樓,"02-28328725",L,M,L,M,L,M,L,M,L,M
I,3920,1267,"22480876",大立光電股份有限公司,臺中巿,臺中巿南屯區精科路１１號,"04-36002345",A,A,A,A,A,A,A,A,A,A
I,3920,1268,"22837088",雷科股份有限公司,高雄巿,高雄巿前鎮區新生路２４８之３９號,"",G,G,F,C,B,A,C,A,C,A
I,3920,1269,"18868215",桂冠實業股份有限公司,臺北巿,臺北巿羅斯福路３段１２６號１樓,"02-23210335",F,K,E,J,E,J,F,J,G,J
I,3920,1270,"96926471",計東企業股份有限公司,新北市,新北市三重區光復路一段８２之５號１０樓,"02-2278-3312",K,L,J,K,J,K,J,K,J,K
I,3920,1271,"80395342",鼎峰自動化股份有限公司,臺中市,臺中市梧棲區草湳里港埠路一段２３５號,"04-2638-0888",L,A,K,G,K,B,K,E,J,D
I,3920,1272,"12898753",品致企業有限公司,臺中市,臺中市大里區健民里仁化工十六路５０號　,"04-24927808",L,M,L,L,L,L,L,L,L,L
I,3920,1273,"07641297",朝比奈企業有限公司,臺北巿,臺北巿中山區中山北路２段２２之１號２樓,"02-25216966",L,M,L,M,L,M,L,M,L,M
I,3920,1274,"22933842",麗翔興業股份有限公司,新北市,新北市新莊區思源路９４巷２號１樓,"02-29974367",L,L,L,L,L,L,M,L,L,L
I,3920,1275,"05010267",任福企業有限公司,台北巿,台北巿寧波西街７６之１號１樓,"02-23516411",L,M,K,M,K,L,K,M,J,L
I,3920,1276,"82823159",樂邦國際有限公司,臺北市,臺北市萬華區萬大路４８６巷８１號,"02-29002888",L,M,L,M,M,M,M,M,M,M
I,3920,1277,"97194039",羚洋科技股份有限公司,桃園市,桃園市桃園區經國路８８８號１１樓之１６,"03-3572097",J,L,H,L,H,K,I,J,H,J
I,3920,1278,"22297358",向億製衣股份有限公司,新北市,新北市中和區連城路２２２巷２弄４號５樓,"02-82451133",L,M,L,M,L,M,L,M,L,L
I,3920,1279,"23570158",利保國際股份有限公司,彰化縣,彰化縣和美鎮竹園里彰新路４段２９１之１號,"04-7364480",J,I,H,E,K,G,L,H,L,I
I,3920,1280,"12052262",利誠行,南投縣,南投縣草屯鎮富寮里富頂路１段３６０巷４０號,"0492561138",L,M,K,M,L,M,L,M,L,M
I,3920,1281,"89265405",立惠企業有限公司,高雄市,高雄市鳳山區林森路３１８號１樓　,"07-7269925",L,M,L,M,L,M,L,M,L,M
I,3920,1282,"79980680",立徠有限公司,臺南市,臺南市安平區國平里健康路３段１８０之１０號１樓,"06-2668876",L,M,L,M,L,M,L,M,L,M
I,3920,1283,"80073095",力勝企業有限公司,新北市,新北市五股區五權七路１８號８樓,"02-22982528",L,M,K,M,K,M,K,M,K,M
I,3920,1284,"23202062",立盛壓克力有限公司,臺南巿,臺南巿新和路２７號１樓,"06-2646597",L,L,J,J,L,K,L,L,J,L
I,3920,1285,"54314534",立暘材料科技有限公司,新北市,新北市淡水區新春街８５巷１９弄１０號５樓,"02-8976-9535",M,M,L,M,M,M,M,M,M,M
I,3920,1286,"80276417",關弘科技股份有限公司,新北市,新北市新店區中興路三段２０５巷８弄６號２樓,"02-27208865",K,L,L,L,L,L,L,L,L,L
I,3920,1287,"28735171",力準國際企業有限公司,新北市,新北市新店區檳榔路２９巷１８號１樓,"02-29003199",L,L,L,L,L,L,L,L,L,L
I,3920,1288,"51162111",香港商徠卡大中華相機有限公司台灣分公司,臺北市,臺北市大安區敦化南路二段９７號２樓,"02-87922628",K,M,G,M,I,M,G,L,M,M
I,3920,1289,"16933648",聯嶧企業有限公司,嘉義市,嘉義市西區新民路１１７號１樓,"05-2351367",L,M,L,M,L,M,M,M,M,M
I,3920,1290,"22898508",聯環科技有限公司,新北市,新北市永和區保生路１號２２樓之１,"02-22320555",K,M,J,L,J,M,K,M,J,L
I,3920,1291,"54581428",樂鑫企業有限公司,臺中市,臺中市東區東門路１５９號１樓　,"0928826675",L,M,L,M,L,M,L,M,L,M
I,3920,1292,"96978478",台灣萊寶股份有限公司,新竹縣,新竹縣竹北市成功十二街３２號１０樓,"03-5001688",J,M,G,M,G,M,G,M,G,M
I,3920,1293,"70849464",臺灣樂金化學股份有限公司台中分公司,臺中市,臺中市梧棲區經一路３９號,"04-26595800",A,B,A,A,A,A,A,A,A,A
I,3920,1294,"27868692",鉝鴻科技有限公司,新北市,新北市三重區溪尾街１１號,"02-28572355",L,L,L,L,L,L,L,L,M,L
I,3920,1295,"80158306",嵩慶欣業有限公司,新北市,新北市新莊區化成路６６０巷１２號（１樓）,"02-85221177",L,L,L,L,L,L,L,J,L,J
I,3920,1296,"70396672",連程實業有限公司,臺北市,臺北市中山區吉林路２４號７樓之２,"02-29008756",K,M,H,M,J,M,L,M,L,M
I,3920,1297,"79998008",聯兆國際科技股份有限公司,高雄市,高雄市左營區新莊一路３１號,"07-3590089",L,L,L,L,M,L,M,L,M,L
I,3920,1298,"28790758",連達國際股份有限公司,新北市,新北市林口區文化二路１段２６６號１８樓之２,"02-26096982",H,L,G,L,F,L,H,L,H,L
I,3920,1299,"55894616",良啟五金鐵網股份有限公司,彰化縣,彰化縣彰化巿福山里福山街２１５巷１２號,"02-29821294",L,G,L,D,L,H,L,G,L,G
I,3920,1300,"24533553",連鈞科技有限公司,新北市,新北市新莊區五工五路５號６樓,"02-8990-1381",L,L,L,K,L,I,L,K,L,L
I,3920,1301,"50802223",聯友金屬科技有限公司,屏東縣,屏東縣枋寮鄉中山路三段103號,"0921221892",A,A,A,A,K,M,M,M,M,M
I,3920,1302,"69692083",立邦國際有限公司,桃園市,桃園市桃園區東埔里信光路１２３號６樓,"0932789489",L,M,L,M,L,M,L,M,M,M
I,3920,1303,"80542111",利百代國際實業股份有限公司,台北市,台北市中山區中山北路二段４５巷２１之１號６樓,"02-25318383",H,K,B,I,A,I,A,H,A,F
I,3920,1304,"13004535",儷寶化粧品股份有限公司,彰化縣,彰化縣鹿港鎮東石里鹿工南六路９號,"04-7811705",J,K,I,F,K,E,L,C,L,F
I,3920,1305,"59211874",立得泰企業有限公司,高雄市,高雄市仁武區八德南路１００巷４弄１２號１樓,"07-3739218",L,L,L,K,L,K,M,L,M,M
I,3920,1306,"86722478",聯琦金屬股份有限公司,臺北巿,臺北巿大安區忠孝東路４段１４２號１２樓之５,"02-27763513",L,L,L,I,K,I,L,J,L,J
I,3920,1307,"84310768",萊富生命科技股份有限公司,臺北巿,臺北巿中正區忠孝東路２段１２３號８樓,"02-23582838",A,M,A,L,A,L,A,L,A,L
I,3920,1308,"24551643",光聚合有限公司,臺北市,臺北市中正區開封街１段３７號６樓,"02-23610855",L,L,L,L,L,M,L,M,L,M
I,3920,1309,"22378963",承賢科技股份有限公司,新北市,新北市樹林區保安街三段１巷１之１號,"02-26881726-239",I,G,G,A,E,A,C,A,G,A
I,3920,1310,"86021813",堃喬股份有限公司,新北市,新北市三重區興德路１１１號５樓,"02-29992993",L,M,L,M,K,M,K,M,K,M
I,3920,1311,"15161502",利達塑膠工業股份有限公司,新北市,新北市三重區光復路一段六八巷一九號,"02-29952424",L,M,L,M,L,M,L,M,L,M
I,3920,1312,"55963768",力生斬板股份有限公司,臺中市,臺中市后里區三豐路五段１７１巷２０號　,"04-25565677",M,L,L,L,L,L,L,L,L,L
I,3920,1313,"91830912",力泰工業股份有限公司,屏東縣,屏東縣竹田鄉大湖村大成路５７號,"08-7773367",I,K,H,F,G,I,H,K,J,L
I,3920,1314,"28790618",立揚箔業科技有限公司,臺南市,臺南市北區海安路３段３３８巷５６之１２號２樓,"06-2832338",L,L,L,L,L,L,L,K,L,K
I,3920,1315,"96893078",立可生有限公司,桃園市,桃園市大園區五權里17鄰五青路156之1號,"03-381-6510",L,L,L,L,L,L,K,K,L,L
I,3920,1316,"75306405",林商行強化安全玻璃廠股份有限公司,高雄巿,高雄巿小港區大業南路四十六號,"07-8711001",K,K,I,J,G,I,H,I,G,H
I,3920,1317,"24363065",林家香食品有限公司,臺中市,臺中市西屯區廣福路３５２巷７０號２樓,"04-24269648",L,M,L,M,M,M,M,M,L,M
I,3920,1318,"22907507",霖門興業有限公司,新竹巿,新竹巿延平路１段５５５號,"03-5261669",L,L,L,L,L,L,K,L,K,L
I,3920,1319,"24208661",京名企業有限公司,花蓮縣,花蓮縣吉安鄉中央路三段６３巷５５號,"(03)8530561",L,M,L,M,L,M,L,M,L,M
I,3920,1320,"28954132",林森林興業有限公司,雲林縣,雲林縣古坑鄉永光村光華路５１號１樓,"05-5825042",L,M,L,M,L,M,L,M,L,M
I,3920,1321,"28560741",翎揚科技有限公司,桃園市,桃園市蘆竹區中福村１８鄰福興７８之２號,"03-3786834",L,M,L,M,L,M,L,M,L,M
I,3920,1322,"24528622",連盈隔熱紙有限公司,高雄市,高雄市鳥松區美勝二街８５號,"07-7354486",L,M,L,M,L,M,L,M,M,M
I,3920,1323,"09502519",六晟工業廠,高雄市,高雄市仁武區竹後里鳳仁路３６９巷２８弄７８號,"07-3755661",L,M,L,M,L,M,L,M,L,M
I,3920,1324,"12991723",六協興業股份有限公司,臺中市,臺中市太平區中平里精美路３１號１樓,"04-2279-1107",J,G,I,B,H,C,H,D,H,B
I,3920,1325,"70724632",立保新有限公司,南投縣,南投縣草屯鎮碧山路２８９號１樓,"049-2306349",L,M,M,M,L,L,L,L,L,M
I,3920,1326,"53806075",立鑫應用科技股份有限公司,臺中市,臺中市南屯區保安二街１７２號,"04-23890367",L,M,L,M,L,M,L,M,L,M
I,3920,1327,"34568833",立盛行有限公司,新北市,新北市三芝區大湖８號,"02-26372018",L,M,K,L,K,L,K,L,J,L
I,3920,1328,"53626427",力天材料有限公司,桃園市,桃園市中壢區圓光路一段５３１號２樓,"03-4980983",M,L,L,L,L,L,M,L,M,L
I,3920,1329,"84406742",勵億塑膠股份有限公司,新北市,新北市新莊區民安東路１７８號,"22032266",J,L,I,L,I,L,I,L,J,L
I,3920,1330,"23029916",理義科技股份有限公司,桃園市,桃園市龜山區興業街９號,"03-3591055",K,I,J,E,J,C,I,A,H,A
I,3920,1331,"22951828",駱泰企業有限公司,桃園市,桃園市桃園區龍鳳一街２號１樓,"03-3693936",K,L,J,K,J,J,K,J,K,J
I,3920,1332,"86467357",錄進科技股份有限公司,新北市,新北市新店區中正路５４２之１號２樓,"02-82187302",L,L,L,L,L,L,L,L,L,L
I,3920,1333,"53070911",宏櫂實業股份有限公司,彰化縣,彰化縣和美鎮彰新路４段２９３號,"04-7368686",L,I,L,F,L,F,L,G,L,H
I,3920,1334,"16357743",路邁爾國際有限公司,桃園市,桃園市龜山區文七五街８２號１樓,"03-3274290",L,M,L,M,L,M,L,M,L,M
I,3920,1335,"70420770",瓏程企業有限公司,高雄市,高雄市鳳山區合作街３８巷９號,"07-7023663",L,L,L,L,L,L,L,L,L,L
I,3920,1336,"28885608",龍合興企業有限公司,高雄市,高雄市鳳山區新康街１４３號９樓,"07-7675169",L,M,L,L,L,M,L,M,L,L
I,3920,1337,"23265220",隆輝安全帽有限公司,臺南市,臺南市永康區崑山里大灣路一○二○巷三三號,"06-2725635",J,K,I,H,H,I,K,L,J,I
I,3920,1338,"16026173",隆德貿易有限公司,臺中市,臺中市北屯區河北西街７７號１樓,"04-22477711",L,M,J,M,K,M,K,M,K,M
I,3920,1339,"84907561",君通實業股份有限公司,新北市,新北市中和區連城路２６８號６樓之６,"02-8227-8568",L,L,K,L,K,L,L,L,L,L
I,3920,1340,"53274680",龍中有限公司,臺南市,臺南市永康區埔園里龍中街６９７號１樓,"06-2016636",L,L,K,L,K,L,K,K,L,K
I,3920,1341,"42856301",龍隆精密科技有限公司,臺北市,臺北市內湖區新明路２１９巷２弄１１號,"02-27956273",L,M,L,M,L,M,L,M,L,M
I,3920,1342,"28424465",香港商耐恒有限公司臺灣分公司,彰化縣,彰化縣員林市三橋里員林大道四段１５０巷２３號５樓　,"04-8327121",K,M,J,M,J,M,J,M,J,M
I,3920,1343,"11456110",美時化學製藥股份有限公司,臺北市,臺北市信義區松仁路277號17樓,"02-2700-5908",H,I,A,C,A,G,E,I,H,I
I,3920,1344,"09427391",台灣路威股份有限公司,臺北市,臺北市信義區忠孝東路５段６８號２５樓,"02-87580660",A,M,A,M,A,L,A,L,A,L
I,3920,1345,"24555660",立中國際有限公司,臺北市,臺北市南港區南港路３段２２３號,"02-27820556",L,M,L,M,L,M,L,M,L,M
I,3920,1346,"89923301",吉隆興業股份有限公司,臺中市,臺中市太平區新仁路一段四四巷八弄三六號,"04-22778309",M,L,L,L,L,L,L,L,M,L
I,3920,1347,"27776764",魯米科技有限公司,桃園市,桃園市中壢區中園路４６９號,"03-4709911",L,K,K,J,K,I,J,J,L,J
I,3920,1348,"28668546",鹿明科技股份有限公司,臺南市,臺南市安南區科技１路２３號,"06-3842107",L,M,L,L,M,M,M,M,L,L
I,3920,1349,"28983811",香港商露美光股份有限公司台灣分公司,新竹縣,新竹縣竹北市中和街６２巷１７弄１號３樓,"03-5533900",M,M,L,K,K,I,K,G,J,A
I,3920,1350,"54955988",美商路銤德股份有限公司台灣分公司,新竹縣,新竹縣竹北市中和街６２巷１７弄１號３樓,"03-5533900#201",L,L,L,K,M,M,M,M,M,M
I,3920,1351,"73628444",龍盟機械股份有限公司,臺南市,臺南市永康區王行里環工路二十號,"06-2321126",L,H,K,B,J,B,K,B,K,E
I,3920,1352,"27390847",龍翩真空科技股份有限公司,臺中市,臺中市梧棲區大通路２號,"04-26595018",I,I,J,F,I,D,G,B,H,E
I,3920,1353,"89328561",瓏晟興業股份有限公司,臺中市,臺中市后里區墩南里七星街９巷３號,"04-25584646",L,L,L,L,L,L,L,L,M,L
I,3920,1354,"54613316",榮朔企業有限公司,高雄市,高雄市鹽埕區北端街２８之３號１樓,"07-7273818",L,M,L,M,L,M,L,M,L,M
I,3920,1355,"14042065",旅東股份有限公司,臺北市,臺北市中山區南京東路２段３６號８樓,"02-25366699",L,L,L,L,L,L,L,L,M,L
I,3920,1356,"14078176",志沛企業有限公司,台北巿,台北巿中山區天祥路４５號２樓,"02-25818329",L,I,L,F,L,F,L,F,L,F
I,3920,1357,"53545092",麗能蘿莎有限公司,臺北市,臺北市信義區松仁路８９號９樓之４,"02-27710086",L,M,M,M,M,M,M,M,L,M
I,3920,1358,"27409992",祿豐室內裝修工程有限公司,臺北市,臺北市中山區南京東路２段６２號５樓之１,"02-82619992",L,L,L,L,L,M,L,M,L,M
I,3920,1359,"16339295",力鳴有限公司,臺中市,臺中市豐原區田心里合作街37巷106號,"04-25317655",L,M,L,L,L,L,L,L,L,M
I,3920,1360,"16719062",凱茂國際企業有限公司,臺北市,臺北市中正區中華路２段５７號２樓,"02-23112714",L,L,L,L,L,L,L,L,M,K
I,3920,1361,"54103756",真津股份有限公司,桃園市,桃園市楊梅區梅獅路二段４６０號,"03-4814495",K,M,I,M,J,M,J,M,K,M
I,3920,1362,"76027140",萬寶至馬達股份有限公司,高雄巿,高雄巿楠梓加工出口區開發路６６號,"07-3621111",B,A,A,A,A,A,A,A,A,A
I,3920,1363,"55712046",明昌國際工業股份有限公司,臺中市,臺中市外埔區大東里大馬路３５４號,"04-26834666",L,A,J,A,J,A,J,A,J,A
I,3920,1364,"68238706",巨超容科技股份有限公司,高雄市,高雄市前鎮區新衙路２９６巷３號,"02-29999411",L,M,L,M,L,M,M,M,M,M
I,3920,1365,"52608359",聚暉股份有限公司,臺中市,臺中市太平區鵬儀路３５２號１樓,"04-22708357",J,D,H,A,F,A,I,A,H,A
I,3920,1366,"23691266",美磊科技股份有限公司,桃園市,桃園市平鎮區南豐路270號,"03-4159111",F,E,C,A,A,A,A,A,A,A
I,3920,1367,"23918123",耕昌企業有限公司,台北巿,台北巿士林區忠義路４２號４樓,"02-28322981",L,M,L,M,L,M,L,M,L,M
I,3920,1368,"23912009",台灣妙管家股份有限公司,新北市,新北市汐止區新台五路１段１１６號１４樓,"02-26962888",I,L,D,L,D,L,E,L,E,K
I,3920,1369,"24385933",台灣神奇文具股份有限公司,臺南市,臺南市安南區頂安里北安路3段396巷50弄111號1樓,"06-2564112",L,M,L,M,L,M,L,M,L,M
I,3920,1370,"23919896",山宏有限公司,新北市,新北市中和區中正路７３８號１０樓之４,"02-8226-1416",L,M,J,M,K,M,K,M,J,L
I,3920,1371,"12719490",渼爾康化粧品股份有限公司,臺南市,臺南市新市區豐華里風鈴路12號,"06-5892377",K,E,J,A,J,A,M,A,M,E
I,3920,1372,"20819325",名超企業股份有限公司,桃園市,桃園市八德區後庄街５１號,"03-3616006",J,L,H,K,F,K,H,L,H,J
I,3920,1373,"22853523",台灣牧田股份有限公司,新北市,新北市林口區文化三路２段７９８號,"02-86019898",C,D,A,A,A,A,A,A,A,A
I,3920,1374,"23101796",滿弓企業有限公司,臺中市,臺中市西屯區至善路65巷26號壹樓,"04-23812188",J,B,J,A,J,A,I,A,J,A
I,3920,1375,"28671036",曼哈頓興業有限公司,臺北市,臺北市內湖區星雲街８０號１樓,"02-27965056",L,L,L,L,M,M,M,M,M,M
I,3920,1376,"11113001",文來貿易股份有限公司,台北巿,台北巿大同區太原路７之４號１樓,"02-25551154",K,M,J,M,J,M,J,L,J,L
I,3920,1377,"53720653",萬鈺股份有限公司,臺北市,臺北市大安區復興南路２段２６８號２樓之２,"02-23777566",L,J,K,F,L,D,M,C,M,E
I,3920,1378,"28365727",茂華實業有限公司,台中市,台中市南屯區永春東一路７１７號１樓,"04-23803355",L,L,I,K,I,K,I,K,H,K
I,3920,1379,"23578829",貿駿企業股份有限公司,臺中市,臺中市南屯區三和里黎明東街３７２號１、２樓,"04-23599322",K,M,L,M,L,M,L,M,M,M
I,3920,1380,"16253043",茂沅實業有限公司,桃園市,桃園市大園區內海里民生路２０７號１樓,"03-3857668",L,M,L,L,L,L,L,L,L,L
I,3920,1381,"50930424",天晟海事有限公司,高雄市,高雄市前鎮區中華五路939巷62號,"075362583",L,M,L,M,L,M,M,M,M,M
I,3920,1382,"23993993",允瀚企業股份有限公司,臺北巿,臺北巿士林區承德路４段２４２號５樓,"02-28831976",M,L,L,J,L,K,L,K,L,K
I,3920,1383,"13042828",敬昕工業有限公司,台中市,台中市南屯區豐昌街５２號１樓,"04-23801768",L,K,M,K,M,K,M,L,L,K
I,3920,1384,"23145632",帆宣系統科技股份有限公司,台北巿,台北巿南港區園區街３之２號６樓,"02-26558899",A,A,A,A,A,A,A,A,A,A
I,3920,1385,"13111177",帆宣系統科技股份有限公司南科分公司,臺南科,臺南科學工業園區臺南市善化區大利二路６號,"06-5055666",A,A,A,A,A,A,A,A,A,A
I,3920,1386,"24413071",美達五金有限公司,高雄市,高雄市燕巢區西燕里中民路４５０號１樓,"07-6161286",L,M,L,M,L,M,L,M,L,M
I,3920,1387,"86383391",台灣丸紅股份有限公司,臺北市,臺北市中山區南京東路３段１６８號１６樓之１、１６樓之２,"02-21735600",C,A,A,A,A,A,A,A,A,A
I,3920,1388,"52296969",丸川商事有限公司,新北市,新北市三重區光復路一段２０號,"02-29990039",L,L,L,M,L,M,L,M,M,M
I,3920,1389,"27538638",台灣丸善科技股份有限公司,臺北市,臺北市中正區忠孝東路２段８８號５樓,"02-23942004",F,K,D,J,E,I,F,I,F,J
I,3920,1390,"23952212",姿華企業有限公司,新北市,新北市中和區中山路３段１２０之１１號６樓,"02-22281560",L,L,K,K,L,K,L,K,J,J
I,3920,1391,"53469123",盈豐材料股份有限公司,新北市,新北市新莊區五權一路１１之１號１、２樓,"02-22901122",L,K,L,K,L,K,L,K,K,K
I,3920,1392,"22456236",鴻霖商業機器有限公司,台北市,台北市內湖區瑞光路２５８巷５０號,"02-87973066",M,M,L,M,L,M,L,M,L,M
I,3920,1393,"80696781",鈺新實業有限公司,台北市,台北市南京東路５段２０２號１２樓之２,"02-27674272",L,M,L,M,L,M,L,M,L,M
I,3920,1394,"84996825",明盛企業有限公司,新北市,新北市林口區民生路６６號,"02-26028167",L,L,K,L,K,L,K,L,L,L
I,3920,1395,"53226739",順美國際有限公司,新北市,新北市汐止區民族二街８６號１１樓,"02-86931308",L,M,L,L,L,M,L,M,L,L
I,3920,1396,"21252712",美朔精密工業有限公司,新北市,新北市三重區興德路９６號９樓,"02-8512-1666",L,G,L,A,L,A,L,A,L,B
I,3920,1397,"54127357",豐在實業有限公司,桃園市,桃園市龜山區嶺頂里幸美街１２５巷１號,"03-82001891",L,L,L,L,L,M,L,M,L,M
I,3920,1398,"50915275",高暐國際有限公司,桃園市,桃園市桃園區新埔六街７７號９樓之５,"0931200996",L,L,L,L,M,M,M,M,M,M
I,3920,1399,"13048317",美視達反光科技股份有限公司,彰化縣,彰化縣員林鎮三條里員水路二段五二號,"04-8317467",L,L,K,K,K,J,J,K,K,K
I,3920,1400,"22751011",緯富科技工業股份有限公司,臺北市,臺北市內湖區內湖路１段３６０巷１５號７樓　,"02-26599055",L,D,L,A,L,A,L,A,L,A
I,3920,1401,"97446160",每得科技有限公司,桃園市,桃園市龜山區文七五街９號１樓,"03-3279168",K,M,J,L,J,L,J,L,K,L
I,3920,1402,"09436650",醫全實業股份有限公司,台北巿,台北巿和平東路２段１０７巷２３之９號２樓,"02-29180011",I,M,B,M,E,M,E,M,E,L
I,3920,1403,"28990073",香港商麥迪康亞太有限公司台灣分公司,宜蘭縣,宜蘭縣五結鄉利工一路二段１１號,"03-9909100",F,A,A,A,A,A,A,A,C,A
I,3920,1404,"28857743",兆慶奈米科技股份有限公司,臺北市,臺北市大同區承德路１段１７號１４樓之６、之７　　,"02-25569798",L,L,L,L,L,L,L,L,L,L
I,3920,1405,"28605374",威日光電股份有限公司,高雄市,高雄市前鎮區明孝里新生路２４８之１９號４樓,"07-8110905",J,L,H,L,A,L,J,M,M,M
I,3920,1406,"27585625",兆聯實業股份有限公司,桃園市,桃園市桃園區桃鶯路４３９之３號,"03-3620101",F,L,A,K,A,K,A,F,A,L
I,3920,1407,"86362776",英濟股份有限公司,新北市,新北市土城區自強街５號１樓,"02-8226-5118",L,J,L,I,L,I,L,I,L,J
I,3920,1408,"21247747",綜茂股份有限公司,臺北市,臺北市內湖區新湖二路２１９號１樓,"02-27968038",L,L,J,L,J,L,J,K,K,K
