I,8536,1917,"42592688",加利利貿易有限公司,高雄市,高雄市三民區大順二路６３０號,"0978523915",L,M,K,M,L,M,K,M,L,M
I,8536,1918,"53581694",歐洲車企業有限公司,高雄市,高雄市仁武區環湖路１１７之１號,"07-3742213",L,M,J,M,K,M,L,M,L,L
I,8536,1919,"28869255",悠樂寶有限公司,新北市,新北市泰山區新五路１段８９號,"02-22969535",L,M,L,M,L,M,L,M,L,M
I,8536,1920,"25056521",歐捷國際興業有限公司,臺中市,臺中市大里區草湖路１３１巷９弄２９號２樓,"04-24738299",L,M,L,M,L,M,L,M,L,M
I,8536,1921,"89700483",歐遠企業有限公司,桃園市,桃園市中壢區榮民南路２６１號,"03-3854539",K,L,J,M,K,M,L,M,M,M
I,8536,1922,"89517232",昆亞有限公司,臺中市,臺中市南屯區豐樂里文心南五路一段３１６號１、２樓,"04-24726110",L,M,L,L,L,L,L,L,L,L
I,8536,1923,"70540022",詠日實業有限公司,臺北市,臺北市中山區中山北路３段３１號５樓,"02-25911981",L,M,L,M,L,M,L,M,L,M
I,8536,1924,"53967368",益高科技有限公司,新竹市,新竹市東區光復路二段２８９號３樓之１,"03-5667900",J,L,G,L,H,L,I,L,H,L
I,8536,1925,"23225229",長榮航空股份有限公司,桃園市,桃園市蘆竹區新南路一段３７６號,"03-3515151",A,K,A,I,A,J,A,J,A,I
I,8536,1926,"53175605",華新精密閥業科技有限公司,宜蘭縣,宜蘭縣五結鄉中里路１８０巷７８號,"03-9603154",L,L,L,L,L,L,L,L,M,L
I,8536,1927,"53256487",以勒綠能光電有限公司,高雄市,高雄市鳳山區文中街２６０巷９號３樓,"07-7808288",L,M,L,M,L,M,M,M,L,M
I,8536,1928,"56355828",瑞士商艾發科技股份有限公司台灣分公司,新竹縣,新竹縣竹北市鹿場里自強南路８號１４樓之１,"",K,L,J,L,J,L,L,M,M,M
I,8536,1929,"80237490",義豐欣企業股份有限公司,臺中市,臺中市南屯區忠勇路１６８之８號,"04-23823760",L,L,L,L,L,L,L,L,L,L
I,8536,1930,"28588071",成朔企業有限公司,新北市,新北市三重區重新路五段６０９巷１２號７樓之１７,"02-2999-6639",L,M,L,M,L,M,L,M,L,M
I,8536,1931,"80545378",怡富興業有限公司,臺中市,臺中市北屯區文心路４段６９６號２２樓之２,"04-22379568",L,L,K,L,L,M,K,M,K,M
I,8536,1932,"12273716",基準科技有限公司,台北巿,台北巿內湖區基湖路１０巷５２號１樓,"02-2659-5586",K,L,I,L,E,L,B,L,D,L
I,8536,1933,"86588182",旗欣股份有限公司,高雄市,高雄市岡山區本洲路９１巷１號,"07-6231199",L,L,L,L,L,L,L,L,M,L
I,8536,1934,"96942958",台灣宇喬實業有限公司,臺北巿,臺北巿內湖區民權東路６段１１巷４３之１號２樓,"02-2791-9352",L,K,L,J,L,I,L,J,L,J
I,8536,1935,"10900276",永善船舶勞務企業社,雲林縣,雲林縣麥寮鄉麥津村８鄰中山路２４４號１樓,"05-6916000",L,M,L,M,L,M,L,M,L,M
I,8536,1936,"23056531",長春工程顧問股份有限公司,台北巿,台北巿民權東路３段１４４號５樓,"02-27191233",L,L,L,H,K,H,K,I,K,F
I,8536,1937,"12147459",崇展貿易股份有限公司,台北巿,台北巿大同區長安西路７８巷３弄４號１樓,"02-25554527",L,M,L,M,L,M,L,M,L,M
I,8536,1938,"27619435",侑永科技股份有限公司,臺南市,臺南市北區西門路４段２７１號８樓之３,"06-2518336",L,K,K,I,I,I,J,J,J,L
I,8536,1939,"07638146",昶福股份有限公司,台北巿,台北巿承德路３段３３號,"02-2595-0266",L,L,K,L,K,L,K,L,K,L
I,8536,1940,"89400818",昇恒昌股份有限公司,臺北市,臺北市內湖區石潭里金莊路１２９號,"02-81785518",A,M,A,M,A,M,A,L,A,M
I,8536,1941,"27459036",弘欣光電企業股份有限公司,新竹縣,新竹縣竹北市文興路２６１號１０樓,"03-5506902",L,M,J,M,J,M,K,M,J,L
I,8536,1942,"97085145",偉度企業有限公司,臺北巿,臺北巿內湖區民權東路６段１２３巷１８號１０樓之１,"02-2793-2888",B,L,A,L,A,L,A,L,A,L
I,8536,1943,"84143679",儁永科技股份有限公司,臺北巿,臺北巿中山區民權東路二段二六號四樓,"02-25361877",L,L,H,L,G,K,H,L,I,I
I,8536,1944,"86003879",勇典工業股份有限公司,桃園市,桃園市桃園區經國路８８８號９樓之１,"03-3168399",L,L,L,K,L,K,L,K,L,L
I,8536,1945,"84203795",奕葉國際有限公司,新竹巿,新竹巿東區金山二街１號,"03-5778994",L,L,L,J,L,J,L,J,L,K
I,8536,1946,"23917026",新呈工業股份有限公司,新北市,新北市汐止區大同路一段３３７巷１６弄１９號１樓,"02-2647-2981",L,L,L,K,L,K,L,K,L,K
I,8536,1947,"86013145",世安企業股份有限公司,新北市,新北市新店區寶橋路２３５巷１３０之２號３樓,"02-89121230",J,M,J,M,I,M,J,M,J,M
I,8536,1948,"12839930",光峰科技股份有限公司,新竹市,新竹市新竹科學工業園區力行六路１號４樓,"03-6667350-4624",K,K,I,J,I,H,H,I,H,H
I,8536,1949,"89639615",慧友電子股份有限公司,新北市,新北市深坑區北深路３段２７０巷８號２樓,"02-26622338",K,J,J,G,J,D,J,A,H,A
I,8536,1950,"53707700",榮芳興業有限公司,新北市,新北市泰山區全興里５鄰仁德路１２１號９樓,"02-22974150",K,M,J,M,J,M,J,M,J,M
I,8536,1951,"84301748",雋儀有限公司,新北市,新北市林口區中華一路７７號６樓,"02-26019679",J,M,K,M,K,M,K,L,J,M
I,8536,1952,"84919047",雋冠有限公司,新北市,新北市林口區中華一路７７號６樓,"02-26019679",L,M,L,M,L,M,L,M,J,M
I,8536,1953,"23867308",長榮航勤股份有限公司,桃園市,桃園市大園區航站南路６之１號１樓夾層２樓,"03-3519941",L,M,H,M,H,M,E,M,F,L
I,8536,1954,"16097775",長榮航太科技股份有限公司,桃園市,桃園市大園區埔心里航站南路６號,"03-3519855",A,L,A,K,A,E,A,G,A,G
I,8536,1955,"04406559",長榮國際儲運股份有限公司,桃園市,桃園市桃園區經國路８９９號,"03-325-2060",L,M,A,M,G,M,F,M,B,M
I,8536,1956,"11337775",長榮海運股份有限公司,台北巿,台北巿中山區民生東路二段１６６號１至４樓,"02-25057766",J,L,E,L,A,L,D,L,H,L
I,8536,1957,"09444482",台灣唯綠包裝股份有限公司,新竹縣,新竹縣湖口鄉中興村工業一路５號,"02-27093232",D,H,A,B,A,D,A,D,A,D
I,8536,1958,"84476394",長榮空廚股份有限公司,桃園市,桃園市大園區航勤北路３號,"03-3513333",K,M,J,M,I,L,A,M,K,M
I,8536,1959,"09457444",九邑貿易有限公司,台北巿,台北巿大安區瑞安街２０８巷５３弄２號１樓,"02-27004850",L,M,L,M,L,M,L,M,L,M
I,8536,1960,"07643470",長友企業有限公司,台北巿,台北巿敦化南路２段６３巷２６號１樓,"02-27070069",L,M,L,M,K,M,J,M,J,M
I,8536,1961,"52686707",合濟工業股份有限公司,臺中巿,臺中巿南屯區精科一路１號,"04-23593178",K,G,K,A,J,A,J,A,J,A
I,8536,1962,"25132990",昶皓國際有限公司,臺北市,臺北市南港區成功路１段３２號５樓之８,"02-27857788",K,M,J,L,K,M,K,M,K,L
I,8536,1963,"20921362",太暘生物科技股份有限公司,新北市,新北市汐止區福德三路３６９號１２樓,"02-2695-7733",J,M,G,M,G,M,H,M,H,L
I,8536,1964,"22460132",永塑國際物流股份有限公司,基隆市,基隆市中正區中正路１８號７樓之１,"02-24260307",L,L,F,L,A,H,H,L,G,K
I,8536,1965,"53290339",新利盛貿易有限公司,臺北市,臺北市信義區信義路４段４０７號１０樓之１,"0903903187",M,M,J,M,J,L,L,L,L,M
I,8536,1966,"97440877",恆翼國際股份有限公司,新北市,新北市三重區光復路１段８２之５號８樓,"85122958",K,L,J,L,J,L,J,L,J,L
I,8536,1967,"34412092",云辰電子開發股份有限公司,新北市,新北市土城區中華路一段５０號３樓,"02-22606868",L,L,L,L,L,L,L,L,L,L
I,8536,1968,"84733443",昶亨科技股份有限公司,高雄市,高雄市前鎮區高雄加工出口區東十街６號　,"07-8152243",K,J,F,D,I,I,I,H,I,J
I,8536,1969,"28549367",日遠科技股份有限公司,桃園市,桃園市中壢區吉林路２３號８樓,"03-4617999",L,L,L,L,I,M,I,L,J,L
I,8536,1970,"89938297",瑞添股份有限公司,臺北巿,臺北巿信義區忠孝東路五段４８２號１７樓之２,"02-27261618",L,M,K,M,K,M,K,M,J,M
I,8536,1971,"80317825",久藝塑膠工業股份有限公司,彰化縣,彰化縣埤頭鄉豐崙村光復東路１００巷５５號,"04-8911647",J,J,I,G,G,G,I,G,I,I
I,8536,1972,"70731015",艾偉特有限公司,台中市,台中市北屯區雷中街１１２巷２２號１樓,"04-22960509",L,K,L,K,L,L,M,L,M,L
I,8536,1973,"22765839",永儲股份有限公司,桃園市,桃園市大園區海口里國際路三段９３２號,"03-3839888-127",A,L,A,L,A,L,A,L,A,L
I,8536,1974,"42748795",永創國際科技有限公司,桃園市,桃園市中壢區五族街３２號,"03-4021779",L,M,L,M,L,M,L,M,L,M
I,8536,1975,"84527529",永電企業有限公司,新北市,新北市汐止區康寧街１６９巷２３號７樓之１,"02-26957033",K,M,L,M,L,M,L,M,L,M
I,8536,1976,"03527507",維恆實業有限公司,台北巿,台北巿和平東路３段２１８號３樓,"02-27333626-8",L,L,K,L,K,L,K,L,K,L
I,8536,1977,"29087808",艾維克科技股份有限公司,新北市,新北市中和區建一路１７６號１８樓,"02-82262868",A,A,A,A,A,A,A,A,A,A
I,8536,1978,"22807676",億驊企業股份有限公司,新北市,新北市新莊區五權一路３號之１,"02-89901777",L,L,L,J,L,H,I,H,K,J
I,8536,1979,"50784597",崇佑科技有限公司,臺北市,臺北市士林區承德路４段１２巷４８號２樓,"0928327721",L,M,L,M,M,M,M,M,M,M
I,8536,1980,"50785147",台灣艾斯剛有限公司,臺北市,臺北市南港區三重路１９之３號７樓之３,"02-26553508",L,M,L,M,L,M,M,M,M,M
I,8536,1981,"70621002",旌暘股份有限公司,苗栗縣,苗栗縣竹南鎮大厝里國泰路６３號,"037-481886",L,I,J,E,J,F,J,C,L,G
I,8536,1982,"52753108",百容電子股份有限公司,台中巿,台中巿南屯區工業區２５路２０號,"04-23598668",I,A,H,A,D,A,E,A,G,A
I,8536,1983,"12246205",英展實業股份有限公司,新北市,新北市新店區寶橋路２３５巷１２７號６樓,"02-89191000",K,L,J,K,J,L,J,K,J,K
I,8536,1984,"22698987",卓新工業股份有限公司,桃園市,桃園市蘆竹區內厝村長安路２段４８號,"03-3222129",L,L,L,J,L,J,L,J,L,J
I,8536,1985,"28712445",翌寶餐飲設備有限公司,臺北市,臺北市內湖區金龍路１３巷１５號,"02-27903787",L,M,L,M,L,M,L,M,L,M
I,8536,1986,"34490505",益森彩藝工業股份有限公司,桃園市,桃園市中壢區吉林路２１號,"03-4520256",E,J,A,H,C,J,C,J,D,J
I,8536,1987,"23961774",怡德貿易有限公司,台南巿,台南巿崇德路６４號,"02-22369687",L,L,L,L,L,L,L,L,L,L
I,8536,1988,"80054647",頂泰科技股份有限公司,桃園市,桃園市平鎮區興隆路８９號,"03-4693398",M,K,L,J,L,I,L,I,L,I
I,8536,1989,"53087244",飛特立航空股份有限公司,臺北市,臺北市松山區敦化北路４０５巷１２３弄３號,"02-87125280",L,M,I,L,I,M,J,L,I,L
I,8536,1990,"24482597",振盛科技有限公司,臺北市,臺北市內湖區新湖二路３６７號３樓３０７室,"02-27963817",L,M,L,M,L,M,L,L,L,L
I,8536,1991,"20823405",北聯電器股份有限公司,桃園市,桃園市龜山區文化一路４０號１樓,"03-3285731",L,E,L,A,L,A,L,A,L,A
I,8536,1992,"22210233",運伸車電股份有限公司,臺中市,臺中市大里區仁化工三路２００號　,"04-24912784",L,L,L,K,L,J,L,J,L,J
I,8536,1993,"86800255",長諺工業股份有限公司,臺中市,臺中市西區臺灣大道二段３０９號２０樓,"04-23265568",L,J,L,F,L,H,L,I,L,H
I,8536,1994,"80701975",伊士博國際商業股份有限公司,新竹市,新竹市東區東光路１３號,"03-5739958",I,I,L,I,L,L,L,L,L,L
I,8536,1995,"42850708",艾歐達國際有限公司,臺北市,臺北市大安區信義路四段６３號６樓,"02-23915579",J,L,I,L,J,L,J,L,L,M
I,8536,1996,"16138163",耀騰股份有限公司,桃園市,桃園市龜山區南上里民生北路１段５３４號３樓,"03-3116170",J,J,I,H,J,I,J,G,J,H
I,8536,1997,"89938374",中韓企業有限公司,新北市,新北市三重區中正南路２８１號１樓,"02-29743880",L,M,L,M,L,M,L,M,L,M
I,8536,1998,"20816452",華儀電子股份有限公司,新北市,新北市汐止區大同路１段２３７號１７樓,"02-21653066",L,F,L,A,L,A,L,A,L,A
I,8536,1999,"22235614",世新電線電纜有限公司,新北市,新北市新莊區中正路６５７號５樓,"02-29086999",L,L,K,K,L,L,L,K,L,L
I,8536,2000,"27492653",易科德室內裝修工程股份有限公司,新竹市,新竹市東區三民里東大路１段１１８號８樓,"03-5421415",L,L,L,L,J,L,K,K,L,G
I,8536,2001,"70733132",溢揚電子股份有限公司,新北市,新北市土城區勝利街３號,"02-22692301",L,L,L,L,L,L,L,L,L,L
I,8536,2002,"89720973",永業欣有限公司,新北市,新北市永和區保生路１號１１樓之８,"02-29296166",L,M,L,L,L,L,L,L,L,L
I,8536,2003,"12706690",立巨電子股份有限公司,臺中市,臺中市西屯區工業區３８路２１０號３樓之１０,"886-4-23550678",K,L,J,L,J,L,J,L,J,L
I,8536,2004,"28045794",易佑科技有限公司,新竹市,新竹市東區經國路一段１４７號１樓　　,"03-5383946",L,L,L,L,L,L,L,L,L,M
I,8536,2005,"84857719",毅永企業有限公司,桃園市,桃園市中壢區民權路２段５９號１樓,"03-4938875",L,L,L,L,L,L,L,L,L,L
I,8536,2006,"80495519",易達聯運股份有限公司,臺北市,臺北市南港區忠孝東路６段４６７號６樓,"02-27881958",M,M,L,M,M,M,M,M,M,M
I,8536,2007,"80410300",亦立科技有限公司,新竹縣,新竹縣竹北市縣政十四街４６號,"03-5633921",G,L,A,H,A,A,A,A,A,A
I,8536,2008,"97119975",光紅建聖股份有限公司,臺北巿,臺北巿北投區立德路１２１巷１２號３樓,"02-2895-9777",J,A,H,A,F,A,E,A,A,A
I,8536,2009,"54210257",羿宗企業有限公司,高雄市,高雄市左營區文川路７４巷３號１１樓　　　　,"0931967831",L,M,L,M,L,L,L,M,L,L
I,8536,2010,"22308566",葵谷科技實業有限公司,新北市,新北市中和區建康路６號２樓,"02-8226-7000",L,L,L,L,L,L,L,L,L,L
I,8536,2011,"80746826",飛田海洋科技股份有限公司,高雄市,高雄市鳳山區忠誠里鳳誠路３８號５樓,"07-5720938",L,L,L,L,L,L,L,L,M,L
I,8536,2012,"28177513",信捷國際股份有限公司,臺北市,臺北市信義區信義路４段４１５號８樓之２,"02-87893088",I,L,D,L,E,L,F,L,G,M
I,8536,2013,"84639279",方美方科技有限公司,新竹市,新竹市北區民富街２５１號１樓,"03-5248804",L,M,L,M,L,L,L,M,K,M
I,8536,2014,"05414444",飛迪精密工業有限公司,新北市,新北市汐止區大同路一段３３７巷１６弄２之１號,"02-26426611",L,L,L,L,L,L,L,L,L,L
I,8536,2015,"30878408",友嘉實業股份有限公司,台北巿,台北巿信義區永吉路１８６號,"02-27639696",I,B,C,A,A,A,G,A,G,A
I,8536,2016,"24335104",及兆系統有限公司,臺北市,臺北市中山區北安路５１８巷１４弄７號,"02-25320118",L,M,K,L,K,M,L,M,L,L
I,8536,2017,"70615521",宏誠動力科技有限公司,臺北市,臺北市松山區南京東路４段１９號５樓之２,"02-25140068",L,M,L,M,L,L,L,L,L,M
I,8536,2018,"20839407",鼎傑企業有限公司,台北巿,台北巿松山區北寧路６２號１樓,"02-27622665-7",L,J,L,H,L,H,L,H,L,H
I,8536,2019,"34174628",菲力工業股份有限公司,新北市,新北市土城區勝利街４號,"02-22602169",A,A,A,A,A,A,A,A,A,A
I,8536,2020,"89979661",富蘭登科技股份有限公司,新竹市,新竹市香山區牛埔路２３８號,"03-5389201",K,L,J,L,H,L,G,L,J,L
I,8536,2021,"70843497",飛弘科技工程有限公司,新北市,新北市中和區中正路８０１號４樓,"02-82276077",M,M,L,M,M,M,M,M,M,M
I,8536,2022,"16535557",益航電子股份有限公司,新北市,新北市中和區中正路７３８號７樓,"02-82269258",L,L,L,L,L,L,L,L,L,L
I,8536,2023,"28462571",仙晨實業有限公司,臺北市,臺北市文山區木柵路１段２５４號１樓,"02-25551155",H,M,A,L,A,M,H,M,K,M
I,8536,2024,"84755092",吉志實業有限公司,新北市,新北市中和區建一路１７５號１０樓,"02-8221-2898",L,L,L,J,L,J,L,J,L,J
I,8536,2025,"55848584",福裕事業股份有限公司,臺中市,臺中市大雅區龍善二街１２號,"04-7991126",L,D,K,A,I,A,K,A,L,A
I,8536,2026,"54668347",飛隼科技有限公司,新北市,新北市汐止區大同路１段１８３號４樓,"02-87920001",J,M,J,M,I,M,H,M,I,M
I,8536,2027,"52513918",基隼系統科技有限公司,臺北市,臺北市士林區大東路１１７號２樓,"02-2882-0200",L,M,L,M,L,M,L,M,M,M
I,8536,2028,"85778614",芳成工業股份有限公司,高雄市,高雄市仁武區鳳仁路２５７號,"07-3712126",K,M,J,L,J,K,J,J,I,J
I,8536,2029,"22457164",方儀企業有限公司,新北市,新北市板橋區萬板路53巷1號,"02-22555221",L,M,L,M,L,M,L,M,L,M
I,8536,2030,"24942950",釩城車業有限公司　,臺北市,臺北市內湖區康寧路３段７５巷１８６弄１２５號　,"02-26931951",L,L,L,M,L,M,L,L,L,M
I,8536,2031,"97125673",佳又盛股份有限公司,新北市,新北市三重區重新路５段６０９巷２０號３樓,"02-2999-2168",L,L,L,L,L,K,L,L,L,L
I,8536,2032,"97024534",凡達床業有限公司,新北市,新北市蘆洲區中原里中正路一八五巷八○弄三號三樓,"02-22810312",L,M,L,M,L,M,L,M,L,M
I,8536,2033,"27577505",寰響國際有限公司,台北市,台北市士林區延平北路５段２５７巷４弄１８號１樓,"02-28116080",L,M,L,M,L,M,L,M,L,M
I,8536,2034,"80203359",能麒企業股份有限公司,新北市,新北市五股區五權七路２２號７樓,"02-2298-1399",L,M,K,L,K,L,K,L,K,L
I,8536,2035,"03522003",遠東航空股份有限公司,臺北巿,臺北巿敦化北路４０５巷１２３弄５號,"02-27121555",L,L,A,L,A,L,A,L,A,K
I,8536,2036,"89392269",遠東先進纖維股份有限公司,桃園市,桃園市觀音區觀音工業區工業五路１７號,"(03)483-7116",A,G,A,A,A,B,A,C,A,D
I,8536,2037,"03522600",遠東新世紀股份有限公司,台北巿,台北巿敦化南路二段２０７號３６樓,"02-2733-8000",A,A,A,A,A,A,A,A,A,A
I,8536,2038,"24659905",發勝漁業股份有限公司　　,高雄市,高雄市前鎮區明道路１１５號,"07-8417207",M,M,L,L,M,L,H,M,M,M
I,8536,2039,"84149060",智原科技股份有限公司,新竹科,新竹科學工業園區新竹市力行三路５號,"03-5787888",A,A,A,A,A,A,A,A,A,A
I,8536,2040,"21234031",昱勤股份有限公司,台北巿,台北巿內湖區洲子街６５號４樓,"02-27988187",L,M,K,M,K,M,K,L,K,L
I,8536,2041,"28467581",明水產業有限公司,台北市,台北市大同區承德路１段１０５號１２樓之５,"02-22965065",L,M,L,M,L,M,L,M,M,M
I,8536,2042,"84074602",億萬年貿易股份有限公司,臺南市,臺南市仁德區保安里開發三路２３號,"06-2666709",L,I,L,B,L,A,L,C,L,E
I,8536,2043,"28085319",遠雄物流事業股份有限公司,桃園市,桃園市大園區航翔路１０１號,"03-3995999",A,L,A,J,A,I,A,J,A,J
I,8536,2044,"16341790",農安機械股份有限公司,臺南市,臺南市新營區開元路８４之１８號,"06-633-3722",L,M,K,M,J,M,J,M,J,M
I,8536,2045,"22979327",帆利航運有限公司,臺東縣,臺東縣臺東市松江路１段５８巷３３號,"089-281047",L,M,L,M,L,M,L,M,M,M
I,8536,2046,"25041746",日華自動化有限公司,新北市,新北市三重區新北大道２段２５２號３樓,"02-29990890",L,M,L,M,L,M,L,M,L,L
I,8536,2047,"24586896",飛斯特科技實業有限公司,臺中市,臺中市清水區神清路８６之１５號１樓,"0978638592",L,M,L,M,L,L,L,M,M,L
I,8536,2048,"01518756",華迅股份有限公司,臺北巿,臺北巿松山區敦化北路８８號１１樓,"02-27112112",L,M,L,M,L,M,L,M,L,M
I,8536,2049,"28847416",易大科技股份有限公司,臺北市,臺北市內湖區民權東路６段１２３巷２４號６樓之４,"02-87910006",M,M,L,M,M,M,M,M,L,M
I,8536,2050,"80002732",振興餐飲設備工程股份有限公司,新北市,新北市蘆洲區長安街四九巷二弄四號二樓,"02-2288-7593",K,M,J,M,J,M,J,M,K,M
I,8536,2051,"23909095",惟凱企業有限公司,新北市,新北市汐止區大同路１段２３９號９樓,"02-26413542",M,M,L,L,K,L,L,L,L,L
I,8536,2052,"86961596",永宏電機股份有限公司,新北市,新北市淡水區中正東路２段２９號２６樓,"02-28082192",L,C,L,A,L,A,L,A,L,A
I,8536,2053,"97186360",澄波企業有限公司,台中巿,台中巿東山路一段３３巷８號１樓,"04-22444255",L,K,L,J,L,J,L,J,L,J
I,8536,2054,"22313104",福哥興業股份有限公司,新北市,新北市新莊區大安路２０號,"",L,L,L,L,K,L,K,L,K,L
I,8536,2055,"23489657",百宏電腦股份有限公司,高雄市,高雄市鳳山區過埤里過昌街１６巷１６號１樓,"07-791-0981",L,L,L,L,L,L,L,L,L,L
I,8536,2056,"42616160",法億科技股份有限公司,臺北市,臺北市內湖區內湖路一段３１６號１２樓,"02-77300018#66",K,M,J,M,J,L,K,M,K,M
I,8536,2057,"04804640",展林企業股份有限公司,臺北市,臺北市南港區園區街３－１號５樓之３,"02-27723316",L,L,K,L,K,L,K,L,K,L
I,8536,2058,"01858585",富晟工業有限公司,新北市,新北市板橋區龍興街７１巷３５號１樓,"0975-335-605",L,M,L,M,L,M,L,M,M,M
I,8536,2059,"86386144",台灣康旭股份有限公司,桃園市,桃園市桃園區新埔六街９９號２３樓,"03-3415521",F,L,I,L,F,L,J,L,K,K
I,8536,2060,"86918992",峰寬企業有限公司,高雄巿,高雄巿新興區南華橫二路１１１號,"07-236-5362",L,M,L,M,L,L,L,M,L,M
I,8536,2061,"01189157",羽陞企業有限公司,新北市,新北市土城區中央路２段１３０號４樓,"02-22603049",L,L,L,M,L,L,L,L,L,L
I,8536,2062,"54175316",滙格股份有限公司,臺北市,臺北市內湖區堤頂大道１段３２７號７樓,"02-27912828",C,L,A,M,A,L,B,M,C,M
I,8536,2063,"44721408",泰豐輪胎股份有限公司,桃園市,桃園市中壢區中華路二段３６９號,"03-4522156",A,A,A,A,A,A,A,A,A,A
I,8536,2064,"13163224",九舟科技股份有限公司,高雄市,高雄市三民區水源路２０３號６樓　　,"(07)3970171",L,L,K,L,K,L,K,L,L,L
I,8536,2065,"59026879",美商聯邦快遞股份有限公司台北分公司,臺北市,臺北市中山區中山北路２段６１號６、９樓,"02-25369090",J,M,M,M,K,M,B,M,D,M
I,8536,2066,"30949500",惠達科技股份有限公司,台北市,台北市大安區仁愛路四段３００巷２６弄１７號１樓,"02-2702-5886",L,M,L,M,L,M,J,L,L,M
I,8536,2067,"04370412",飛泰貿易有限公司,新北市,新北市中和區建一路１５０號１４樓之１,"02-82265570",K,L,J,J,J,J,I,J,J,J
I,8536,2068,"84430243",協記精密工業股份有限公司,臺中市,臺中市霧峰區林森路９４７號　,"04-23391802",L,L,K,L,K,K,L,K,L,L
I,8536,2069,"16436070",美商飛昱科技股份有限公司台灣分公司,新竹縣,新竹縣竹北市台元街２８號７樓之１,"03-6116999",G,M,A,M,A,M,A,M,A,M
I,8536,2070,"53185646",飛利達科技有限公司,新北市,新北市板橋區莊敬路９號８樓,"02-22504189",L,L,L,L,L,L,L,M,L,M
I,8536,2071,"22135220",飛絡力電子股份有限公司,彰化縣,彰化縣和美鎮中興路１段１３３號,"04-7330435",L,J,G,F,E,E,G,D,L,C
I,8536,2072,"28546143",圓環國際科技有限公司,新竹縣,新竹縣竹北市台元一街８號２樓之５,"03-5601566",K,L,J,L,J,L,I,L,J,L
I,8536,2073,"12434305",萬象科技企業有限公司,新北市,新北市中和區中和路４０２號１７樓,"02-89230066",L,M,L,M,L,M,L,M,L,M
I,8536,2074,"86331090",樂聲實業有限公司,彰化縣,彰化縣溪湖鎮員鹿路２段３３５巷３６號,"04-8820382",L,L,L,L,L,L,M,L,L,L
I,8536,2075,"23290516",成聯通運股份有限公司,臺北巿,臺北巿松山區南京東路５段３４號６樓,"02-27466606",M,M,L,L,L,M,L,M,L,M
I,8536,2076,"16720997",芬瑩企業有限公司,新北市,新北市板橋區僑中一街１３８號１樓,"02-22726656",L,L,K,L,K,L,K,K,K,J
I,8536,2077,"27753642",蘴第企業有限公司,臺北市,臺北市大同區蘭州街４８號,"02-25852256",K,M,J,M,J,M,J,M,J,M
I,8536,2078,"24454950",楓展企業有限公司,臺北市,臺北市中山區民族東路４１０巷２３弄１９號１樓,"02-25153087",L,M,L,M,L,M,L,M,L,M
I,8536,2079,"27877019",豐呈科技股份有限公司,臺中市,臺中市烏日區公園路３９７號,"04-23380985",L,K,L,J,L,J,L,J,L,J
I,8536,2080,"84361077",楓富機械股份有限公司,臺中市,臺中市太平區中山路４段９６巷４號１樓,"04-2395-2786",M,K,L,J,L,J,M,J,M,J
I,8536,2081,"28523107",鋒剛機械有限公司,桃園市,桃園市中壢區文化二路２８３號５樓,"03-3648569",L,M,L,M,L,M,L,M,L,M
I,8536,2082,"55389357",豐興鋼鐵股份有限公司,臺中市,臺中市后里區甲后路一段９９８號,"04-25565101",A,A,A,A,A,A,A,A,A,A
I,8536,2083,"46460673",丰慶股份有限公司,新北市,新北市樹林區保安街１段３６２號３樓,"02-26872389",L,M,L,M,L,M,L,M,L,M
I,8536,2084,"42743193",豐榕國際有限公司,桃園市,桃園市蘆竹區南山路一段４７號７樓之１,"03-2120807",K,M,K,M,K,M,K,M,K,M
I,8536,2085,"63400932",豐泰企業股份有限公司,雲林縣,雲林縣斗六巿６４０科工八路五十二號,"05-5379100",J,A,F,A,G,A,G,A,E,A
I,8536,2086,"25199252",豐悅企業有限公司,臺中市,臺中市北屯區舊社里松竹五路一段３１２號１樓　,"04-7376868",J,M,J,M,J,M,K,M,L,M
I,8536,2087,"54853841",風芸軒有限公司,新北市,新北市林口區中山路５３６號８樓,"03-3180370",L,L,L,K,M,K,M,L,M,M
I,8536,2088,"85975690",鋒毅實業有限公司,高雄市,高雄市仁武區仁心路２５７巷３號　　　,"07-3710769",L,M,L,M,L,L,L,L,M,M
I,8536,2089,"76355522",滙茂實業股份有限公司,高雄巿,高雄巿苓雅區民權一路３４號１６樓之４,"07-7873305",K,L,L,L,M,L,L,L,L,L
I,8536,2090,"24576052",律輝科技股份有限公司,臺北市,臺北市內湖區新湖二路128號5樓之1,"02-26583302",L,M,L,M,L,M,L,M,M,M
I,8536,2091,"81147671",飛斯妥股份有限公司,新北市,新北市林口區林口第二工業區工八路９號,"02-26019281",F,M,A,L,A,L,A,L,A,L
