I,8536,3837,"22009238",經穗貿易股份有限公司,臺北市,臺北市內湖區新湖三路１１８號５樓,"02-87928699",L,M,L,M,L,M,L,M,L,L
I,8536,3838,"22132286",慶陞工業股份有限公司,桃園市,桃園市平鎮區關爺東路３２號,"03-4589558",L,G,J,B,J,A,J,A,K,B
I,8536,3839,"12980465",金達科技股份有限公司,台北市,台北市中山區建國北路二段一二九號四樓,"02-25010456",K,M,K,L,K,L,K,M,K,M
I,8536,3840,"16449928",金棠科技股份有限公司,臺中巿,臺中巿西屯區協和里工業區七路２０號,"04-23592997",L,M,J,M,K,M,H,L,L,L
I,8536,3841,"22439103",近鐵運通股份有限公司,台北市,台北市中山區長安東路二段９９號３樓,"02-2506-3151",A,M,A,L,A,L,A,F,A,L
I,8536,3842,"53876579",台灣奇普股份有限公司,桃園市,桃園市龜山區南美街１０８號,"03-3521119",L,M,L,M,L,M,L,M,L,M
I,8536,3843,"24785115",琦瑞昇股份有限公司,臺北市,臺北市大安區樂利路42巷2號2樓,"02-27005055",L,M,L,M,L,M,L,M,M,M
I,8536,3844,"23975469",積馳機械股份有限公司,台中巿,台中巿復興路４段１０６號２Ｆ,"04-22242662",L,M,K,M,K,M,L,L,L,L
I,8536,3845,"28991474",瑞士商奇石樂科技股份有限公司台灣分公司,臺北市,臺北市內湖區民權東路６段１８０巷６號５樓之１７,"02-77212121",L,M,K,M,K,M,J,M,K,M
I,8536,3846,"86052174",北海貿易有限公司,高雄市,高雄市左營區明誠二路２４５號１０樓,"07-5565906",L,M,L,M,L,M,L,M,L,M
I,8536,3847,"23076430",經登企業股份有限公司,新北市,新北市五股區五權八路２０號,"02-22993794",L,I,K,E,L,D,L,D,L,E
I,8536,3848,"23931152",國際北川工業股份有限公司,新北市,新北市汐止區新台五路一段７５號７樓,"02-2698-8833",L,G,K,C,K,C,J,C,J,D
I,8536,3849,"22853235",北原工業股份有限公司,彰化縣,彰化縣芳苑鄉後寮村芳苑工業區工區路３８號,"048-965138",L,L,L,K,L,J,L,J,L,K
I,8536,3850,"84092685",昱鑫國際事業有限公司,臺中巿,臺中巿北屯區松竹路二段１３１號１樓,"04-2241-5775",L,M,L,M,L,M,L,L,L,M
I,8536,3851,"86667003",廚霸王不銹鋼工業有限公司,新北市,新北市板橋區干城路２０巷１５號１樓,"02-26803885",L,M,L,L,L,L,L,L,L,L
I,8536,3852,"53950269",台灣開道股份有限公司,臺北市,臺北市松山區民生東路３段１２８號１２樓之１,"",K,M,J,M,I,M,J,M,J,M
I,8536,3853,"76027731",台灣北澤股份有限公司,高雄巿,高雄巿楠梓加工出口區東五街２６號,"07-3611236",E,A,A,A,A,A,A,A,A,A
I,8536,3854,"54118701",冠傑精密科技有限公司,新竹縣,新竹縣竹東鎮二重里中央路２２巷１６號３樓,"03-5830531",L,L,L,L,M,L,L,L,M,L
I,8536,3855,"24247783",晶傑科技有限公司,新竹市,新竹市高翠路２１０巷３弄２號,"03-561-7717#12",J,M,K,L,K,L,K,L,L,L
I,8536,3856,"23826834",美商科磊股份有限公司台灣分公司,新竹縣,新竹縣竹北巿台元街２２號１樓,"03-5526128",A,L,A,L,A,L,A,L,A,L
I,8536,3857,"53349211",凱理有限公司,臺北市,臺北市內湖區內湖路１段６６號１０樓（８０６室）,"02-66038806",M,L,L,L,L,K,L,K,L,K
I,8536,3858,"43138482",德商克倫克包裝服務有限公司台灣分公司,臺北市,臺北市信義區信義路五段７號３７樓,"02-27920864",L,L,L,L,K,L,K,L,L,M
I,8536,3859,"25166610",科祿柏科技有限公司,桃園市,桃園市蘆竹區南崁路二段６６號３樓之３,"03-3128516",L,K,L,J,L,I,L,J,L,J
I,8536,3860,"43448402",康鈦科技股份有限公司,臺北市,臺北市信義區信義路５段２號１６樓,"02-23458088",I,M,E,M,E,M,F,L,H,M
I,8536,3861,"89560650",藍科實業有限公司,新北市,新北市中和區保健路一○六巷十二弄十六之二號三樓,"02-29401118",K,M,J,M,J,M,K,M,K,M
I,8536,3862,"86313311",紐澳德開發有限公司,台北市,台北市內湖區基湖路３５巷１１號９樓,"02-87516633",L,L,J,L,L,K,L,K,L,K
I,8536,3863,"27463931",丞惠有限公司,臺北市,臺北市信義區信義路５段５號,"02-27201180",L,L,L,M,L,M,L,M,L,M
I,8536,3864,"80171321",科協儀器股份有限公司,台北市,台北市中正區忠孝東路一段１１２號６樓,"02-2703-2129",K,L,J,L,J,L,J,L,J,L
I,8536,3865,"22100067",高雄興亞股份有限公司,高雄巿,高雄巿楠梓加工出口區開發路１７－２號,"07-3634157",H,I,D,G,A,F,D,F,F,G
I,8536,3866,"07661589",廣奕企業有限公司,台北巿,台北巿太原路１５６巷１５號１樓,"02-25514035",L,L,K,L,J,L,K,L,K,L
I,8536,3867,"06783971",台純工業有限公司,高雄市,高雄市鼓山區篤敬路７號９樓,"07-5502307",L,L,L,M,L,L,L,L,L,M
I,8536,3868,"23743519",世頂企業有限公司,新北市,新北市三重區光復路１段８２之８號８樓,"02-8512-3210",L,M,K,L,K,K,L,L,K,L
I,8536,3869,"28568764",科奇國際股份有限公司,新北市,新北市板橋區文化路１段２６６號９樓,"02-82581958",L,L,K,K,K,J,K,J,J,J
I,8536,3870,"97033029",香岳實業股份有限公司,苗栗縣,苗栗縣竹南鎮建國路３４８號,"037-551155",L,L,K,L,K,L,K,L,K,L
I,8536,3871,"21228832",科安企業股份有限公司,臺北巿,臺北巿信義區忠孝東路５段５５０號９樓,"02-27282767",K,M,I,M,I,M,I,L,J,M
I,8536,3872,"75917068",寶令企業有限公司,高雄巿,高雄巿前鎮區瑞政街１８８號,"07-8319002",L,L,L,L,L,L,M,L,M,M
I,8536,3873,"97164400",亞太國際電機股份有限公司,新竹巿,新竹巿北區北大路２８２號９樓,"03-5285788",I,M,H,K,C,K,B,L,A,L
I,8536,3874,"80251181",柯隆科技有限公司,桃園市,桃園市八德區永豐南路３１巷５０弄２９號,"03-4359124",L,M,L,M,L,M,L,M,L,M
I,8536,3875,"12953615",台灣小森股份有限公司,臺北市,臺北市信義區基隆路２段５１號７樓,"02-2737-1200",L,M,J,M,K,M,K,L,K,M
I,8536,3876,"23275971",福鄉通商股份有限公司,彰化縣,彰化縣員林市大仁南街９６號,"04-8334851",L,K,L,J,K,J,L,J,L,K
I,8536,3877,"54960949",康莊科技股份有限公司,新竹縣,新竹縣竹北市隘口里高鐵七路65號8樓之1,"03-6682283",M,M,L,M,M,M,M,M,M,M
I,8536,3878,"04208832",台灣通力電梯股份有限公司,新北市,新北市板橋區縣民大道２段６８號１０樓,"02-29589688",J,M,G,M,G,M,F,M,F,L
I,8536,3879,"89570756",港泰科技有限公司,新北市,新北市中和區中山路３段３５號８樓之１１,"02-22210947",M,M,L,M,M,M,M,M,M,M
I,8536,3880,"12766155",康稜有限公司,桃園市,桃園市桃園區敬三街１９０巷８號１０樓,"03-3017156",L,M,L,M,L,M,L,M,L,M
I,8536,3881,"70399869",光宸科技股份有限公司,臺北市,臺北市內湖區堤頂大道２段４１５號５樓,"02-2799-2789",K,I,K,D,J,C,L,C,L,E
I,8536,3882,"27653741",韓寶國際企業有限公司,新北市,新北市泰山區新北大道６段４０１號２樓,"02-29030223",L,L,K,M,J,M,J,L,L,M
I,8536,3883,"28006259",台灣客喜達汽車百貨股份有限公司,新北市,新北市新莊區新北大道2段217號5樓,"02-85214198",L,M,K,M,K,M,K,M,K,M
I,8536,3884,"53660085",日商甲信工業股份有限公司台灣分公司,臺中市,臺中市西屯區大信街５２號２樓之２,"04-23169270",M,L,L,K,L,J,M,J,L,J
I,8536,3885,"27556614",台裕國際股份有限公司,臺北市,臺北市中山區中山北路２段１２９號１１樓之３　,"02-25625886",K,L,J,L,I,L,L,L,L,L
I,8536,3886,"86791592",國品實業股份有限公司,臺中市,臺中市大雅區中清路四段７６６號,"04-2568-9367",K,G,J,A,I,A,J,A,I,A
I,8536,3887,"53345171",台灣興和通商股份有限公司,臺北市,臺北市中山區松江路１２２號８樓,"02-25232860",K,M,K,L,J,L,J,L,J,L
I,8536,3888,"84151017",益源隆股份有限公司,臺中市,臺中市潭子區民族路一段４０２號,"04-25324345",L,L,L,L,L,L,L,L,L,L
I,8536,3889,"25185341",恒揚國際電子股份有限公司,桃園市,桃園市蘆竹區南崁路２段８１號１０樓,"03-3229188",K,M,H,L,G,L,F,L,C,L
I,8536,3890,"16434306",光洋林博股份有限公司,臺北市,臺北市北投區裕民六路120號5樓,"02-2826-4254",L,L,L,L,L,L,L,L,L,L
I,8536,3891,"53667030",台塑科騰化學有限公司,雲林縣,雲林縣麥寮鄉中興村台塑工業園區１之１號,"",K,M,I,M,G,M,H,M,H,M
I,8536,3892,"53025888",美商克里斯有限公司台灣分公司,臺北市,臺北市松山區敦化北路２０７號９樓之５,"02-25451761",L,H,K,D,K,H,L,J,L,K
I,8536,3893,"80990285",明水自動車精品行,台北市,台北市大同區承德路１段１０５號１２樓之５,"02-22965065",L,M,L,M,L,M,L,M,L,M
I,8536,3894,"80390326",光格國際有限公司,新北市,新北市板橋區大觀路２段１７４巷１７３弄１０之１號,"02-82213259",L,L,L,K,L,J,L,J,M,J
I,8536,3895,"84306125",台灣凱士比股份有限公司,臺北市,臺北市大安區信義路三段１３２號７樓,"02-27079188",K,M,I,L,I,L,I,L,J,L
I,8536,3896,"54277215",啟均有限公司,新北市,新北市新莊區新莊路１６１號,"02-2998-7171",L,M,L,M,L,M,L,M,L,M
I,8536,3897,"24234289",廣澤發科技有限公司,桃園市,桃園市中壢區忠福里南園二路２９６巷２１弄６６號３樓,"03-4520849",K,M,J,M,J,M,J,M,J,M
I,8536,3898,"16960829",廣鐸企業有限公司,臺中市,臺中市北屯區豐樂路２段２６６號１樓,"04-22032124",J,M,J,M,J,M,J,M,J,M
I,8536,3899,"23320125",鼓達股份有限公司,臺北巿,臺北巿文山區景興路４２巷４弄１０號,"02-29316472",L,M,M,M,M,M,M,M,M,M
I,8536,3900,"47094210",廣大保利龍股份有限公司,新竹縣,新竹縣湖口鄉光復路３４號,"03-5983611",L,L,L,L,M,M,L,M,L,M
I,8536,3901,"28589212",貫旭企業有限公司,桃園市,桃園市中壢區西園路１１１之３號８樓,"03-4353118",L,M,L,L,L,L,L,L,L,L
I,8536,3902,"53293933",寬準股份有限公司,臺中市,臺中市南區和平里和昌街114號,"04-23363608",L,M,L,M,L,M,L,M
I,8536,3903,"27389412",廣和科技股份有限公司,新北市,新北市新莊區大安路１１號,"02-22037000",L,K,J,I,K,J,L,L,L,L
I,8536,3904,"12283854",光理有限公司,臺北巿,臺北巿松山區南京東路五段１６３號１６樓之５,"02-27465280",L,L,J,L,J,L,J,L,K,L
I,8536,3905,"73649454",廣泰金屬工業股份有限公司,臺南市,臺南市官田區二鎮里工業路二十號,"06-6987615",A,A,A,A,A,A,A,A,A,A
I,8536,3906,"22249693",光威電機工業有限公司,臺中巿,臺中巿西屯區何甘里甘州二街一三號,"04-23162179",L,L,L,L,K,M,K,L,K,L
I,8536,3907,"28805210",廣鎰電子有限公司,新北市,新北市三峽區光明路７５巷２２之１號,"02-26745663",L,L,L,M,L,L,L,L,L,L
I,8536,3908,"86164683",廣迎新工業股份有限公司,桃園市,桃園市中壢區東園路１３號,"03-4620703",L,L,K,L,L,L,L,L,L,L
I,8536,3909,"51272200",光榮工業股份有限公司,臺中市,臺中市大里區健民里仁化路２１５號,"04-24916181",K,E,H,A,G,A,H,A,G,A
I,8536,3910,"89991270",鑛達工業有限公司,臺中市,臺中市神岡區神岡里神圳路三十巷十六號,"04-25629213",L,M,L,M,L,M,K,M,K,M
I,8536,3911,"83743099",坤展貿易股份有限公司,高雄巿,高雄巿鼓山區龍德路卅四巷十一號,"07-5553030",J,L,G,L,H,L,H,L,H,L
I,8536,3912,"86257578",昆德金屬企業有限公司,新北市,新北市新莊區新樹路五二七巷四十二號," ",L,L,L,K,L,L,L,K,L,M
I,8536,3913,"16873536",台灣庫卡股份有限公司,臺北市,臺北市內湖區陽光街２９８號１樓,"02-89781188",G,M,E,L,A,M,H,L,H,L
I,8536,3914,"70405118",庫力索法股份有限公司,高雄市,高雄市前鎮區新都路1號5樓,"07-2200800",E,L,A,L,A,L,A,M,A,M
I,8536,3915,"54864024",星鴻科技股份有限公司,新北市,新北市汐止區新台五路一段８１號１８樓之３,"02-27884669",M,M,L,M,M,M,M,M,M,M
I,8536,3916,"16125364",公理實業有限公司,高雄巿,高雄巿三民區大順三路３１１號１２樓之１,"07-5519193",M,M,L,M,L,M,L,M,L,M
I,8536,3917,"20827660",明峯電子股份有限公司,臺北巿,臺北巿大安區基隆路二段一一０號六樓,"02-23770022",L,L,L,L,L,L,L,L,L,L
I,8536,3918,"85974475",國城建設股份有限公司,高雄市,高雄市新興區中正三路１６０號１２樓之１,"07-2350121",L,M,L,L,L,L,M,L,M,L
I,8536,3919,"22901285",國華牙材股份有限公司,新北市,新北市中和區中山路２段３５１號６樓之１,"02-2226-1770",I,M,E,L,D,L,B,L,B,L
I,8536,3920,"11594991",國明貿易有限公司,台北巿,台北巿長安西路７８巷４弄３之１號,"02-25113318",L,M,L,M,L,M,L,M,L,M
I,8536,3921,"06375145",國邦化學股份有限公司,臺南市,臺南市新市區港墘里興業路８號,"06-5993611",J,L,I,L,I,L,I,L,J,L
I,8536,3922,"84693195",國亦興企業有限公司,彰化縣,彰化縣埔心鄉中正路１段４３７巷１７號２樓,"04-8298521",L,M,L,M,L,M,L,M,L,M
I,8536,3923,"04890624",崑義實業股份有限公司,台北巿,台北巿萬慶街３２巷１５號１樓,"02-29318121",K,L,J,L,J,L,J,L,J,L
I,8536,3924,"50753665",國通貿易有限公司,新北市,新北市新莊區新北大道３段３號７樓　　,"02-85219088",L,M,L,M,M,M,M,M,M,M
I,8536,3925,"86973853",國郁企業股份有限公司,雲林縣,雲林縣斗六市科加六路１７號,"05-5513222",L,K,K,J,K,J,K,J,L,K
I,8536,3926,"12488060",國瑞汽車股份有限公司,桃園市,桃園市中壢區定寧路７３號　,"03-4611222",A,F,A,A,A,A,A,A,A,A
I,8536,3927,"31111902",庭田企業有限公司,新北市,新北市三重區重新路五段６０９巷４號６樓,"02-29991906",L,J,L,G,L,G,L,F,L,F
I,8536,3928,"89577667",科映有限公司,新北市,新北市中和區建康路２號６樓,"02-232345290",L,L,K,L,L,L,L,L,L,L
I,8536,3929,"53239431",呈海有限公司,高雄市,高雄市前鎮區漁港東二路３號３樓　　,"07-9767770",L,J,L,K,L,I,L,L,L,J
I,8536,3930,"53429951",谷亞電子有限公司,新北市,新北市永和區保生路２號１４樓,"02-82316033",L,L,L,L,L,L,L,L,L,M
I,8536,3931,"07291518",冠球股份有限公司,桃園市,桃園市楊梅區新江路２０２號,"03-4781151",J,H,I,C,G,A,G,B,G,B
I,8536,3932,"13068381",冠銓工業股份有限公司,臺中市,臺中市東區振興路４１２巷１３０號,"04-22113698",L,L,L,L,L,L,M,L,L,L
I,8536,3933,"12632591",光景工業有限公司,新北市,新北市新莊區八德街１２５號４樓,"02-29071860",M,M,L,M,L,J,L,J,L,J
I,8536,3934,"35129447",光大企業股份有限公司,新北市,新北市五股區更洲路七○號,"02-2971-3333",M,L,L,J,L,J,L,J,L,K
I,8536,3935,"75195800",光陽工業股份有限公司,高雄巿,高雄巿三民區灣興街３５號,"07-3822526",A,A,A,A,A,A,A,A,A,A
I,8536,3936,"30834325",廣盈五金企業有限公司,台北巿,台北巿信義路２段７４，７６號１樓,"02-23928336",L,M,L,L,L,M,L,M,L,M
I,8536,3937,"79975357",愷威企業股份有限公司,苗栗縣,苗栗縣竹南鎮建國路２８８巷５３弄９號,"037-552257",M,M,L,M,L,M,M,M,M,M
I,8536,3938,"54616974",凱偉工業有限公司,高雄市,高雄市苓雅區中正一路１２０號４樓之３,"0932502542",L,M,L,L,L,M,L,L,L,M
I,8536,3939,"85851699",鯤鯓工業有限公司,高雄市,高雄市大寮區中庄里四維路４１號,"07-7013589",L,L,L,K,L,L,L,L,L,L
I,8536,3940,"70812945",京元電子股份有限公司竹南分公司,苗栗縣,苗栗縣竹南鎮頂埔里中華路１１８號,"037-595666",A,A,A,A,A,A,A,A,A,A
I,8536,3941,"04590577",冠宇國際電訊股份有限公司,新北市,新北市中和區建康路１５８號８樓,"02-3234-9898",L,L,L,L,L,L,D,L,H,L
I,8536,3942,"16841367",新加坡商京瓷亞太有限公司台北分公司,臺北市,臺北市中山區南京東路二段１０１號８樓,"02-25672008",C,L,A,M,J,M,L,M,L,M
I,8536,3943,"53566336",昱鑫科技股份有限公司,桃園市,桃園市平鎮區平東路一段１７８巷２６弄１１號,"03-4508250",L,K,L,I,L,J,L,I,L,J
I,8536,3944,"12724135",京鑰企業有限公司,新北市,新北市新店區寶橋路２３５巷１２３號７樓之２,"02-89191289",L,M,K,M,K,M,K,M,K,M
I,8536,3945,"69664988",錸鐽科技有限公司,桃園市,桃園市龍潭區渴望路８３號１樓,"03-4072786",L,K,M,J,L,J,M,L,M,M
I,8536,3946,"89470383",力臻股份有限公司,臺北巿,臺北巿北投區吉利街一三一號二樓,"28270158",L,L,K,L,L,L,L,L,L,L
I,8536,3947,"80072883",力勁機械股份有限公司,臺中市,臺中市西屯區科園路３０號,"04-24619797",L,K,K,H,J,D,L,F,L,F
I,8536,3948,"42671521",大均貿易有限公司,台中市,台中市南區德富路２１９號５樓之５,"04-22605796",L,M,L,M,L,L,L,M,L,M
I,8536,3949,"38426759",柔洋股份有限公司,新北市,新北市汐止區新台五路１段７９號４樓之４,"02-26981766",L,L,L,L,L,L,L,L,L,L
I,8536,3950,"28471163",愛樂視訊有限公司,臺北市,臺北市中正區金山南路一段１５５號Ｂ１,"02-23212138",L,M,L,M,L,M,L,M,M,M
I,8536,3951,"23427695",肯昱興業有限公司,台北市,台北市內湖區洲子街７２號３樓,"02-8797-5598",L,L,L,L,L,L,L,L,L,L
I,8536,3952,"97281287",森悅股份有限公司　　,台北市,台北市內湖區民權東路６段９０巷２５弄４５號,"02-27197978",L,M,L,L,L,M,L,M,L,M
I,8536,3953,"53813929",昌益國際股份有限公司,新竹市,新竹市東區埔頂路２５１之２號６樓,"03-6578576",L,L,L,L,L,L,L,L,L,L
I,8536,3954,"22253099",楠弘貿易股份有限公司,高雄巿,高雄巿前鎮區復興四路１２號１１樓之３,"07-3382000",I,M,G,M,D,M,E,M,F,M
I,8536,3955,"52796325",賴記電機有限公司,臺中市,臺中市南屯區豐樂里豐順街41號1樓,"04-23821881",L,M,L,M,L,M,L,M,L,M
I,8536,3956,"29004954",來克車業有限公司,屏東縣,屏東縣竹田鄉竹南村新興路1巷16-10號,"08-7711918",L,M,K,M,K,M,K,L,K,M
I,8536,3957,"45886551",萊明雷射科技有限公司,臺中市,臺中市西屯區弘孝路１９號１２樓之１,"04-27061412",L,M,L,M,L,M,L,M,L,M
I,8536,3958,"96956410",萊爾德電子材料股份有限公司,新北市,新北市五股區五權六路２２號,"02-22901234",J,I,H,F,G,G,I,G,I,G
I,8536,3959,"82915235",貨拉拉物流有限公司,臺中市,臺中市梧棲區文華街２８巷２８號２樓,"04-26570877",L,M,K,M,M,M,M,M,M,M
I,8536,3960,"84897212",香港商科林科技有限公司台灣分公司,新竹市,新竹市東區公道五路三段１號８樓之１、２,"03-5798666",A,L,A,M,A,L,A,L,A,L
I,8536,3961,"96996644",聯銘有限公司,新竹市,新竹市中華路６段７２２巷１０號,"03-5370100",L,L,L,L,L,L,L,L,L,L
I,8536,3962,"23074833",聯成電機股份有限公司,新北市,新北市土城區中興路２０號１樓,"02-22685954",L,L,L,L,K,L,J,L,J,L
I,8536,3963,"70732725",彰溢企業有限公司,彰化縣,彰化縣和美鎮孝義路３５０巷８４弄２０號,"04-7330158",L,J,L,G,L,G,L,H,L,H
I,8536,3964,"16990957",聯笙電業股份有限公司,新北市,新北市汐止區大同路一段３３７巷１６弄２５號,"02-8642-1505",L,M,J,M,J,M,J,L,L,M
I,8536,3965,"22353766",聯盈電子股份有限公司,臺北巿,臺北巿內湖區南京東路６段３３０巷１８弄２號３樓,"02-27923756",K,I,I,F,J,E,J,E,J,F
I,8536,3966,"22327466",立端科技股份有限公司,新北市,新北市汐止區大同路２段１７３號７樓,"02-86926060",A,A,A,A,A,A,A,A,A,A
I,8536,3967,"28845260",昱樺科技股份有限公司,臺北市,臺北市內湖區堤頂大道一段３３號７樓,"02-27902589",L,I,L,F,L,G,L,F,L,F
I,8536,3968,"12956633",台灣良途股份有限公司,臺北市,臺北市內湖區內湖路１段３６０巷１５號３樓,"02-26581047",L,M,L,M,L,M,L,M,L,L
I,8536,3969,"86323660",聯致實業有限公司,桃園市,桃園市中壢區松信二街２５號,"03-4202246",L,L,L,L,L,L,L,L,L,M
I,8536,3970,"69660511",富貴族電機有限公司,臺南市,臺南市安南區安和路２段２巷２５號,"06-3556847",L,M,L,L,L,L,L,M,L,M
I,8536,3971,"22480876",大立光電股份有限公司,臺中巿,臺中巿南屯區精科路１１號,"04-36002345",A,A,A,A,A,A,A,A,A,A
I,8536,3972,"16992625",麗清科技股份有限公司,新北市,新北市中和區民享街４號,"02-22226112",J,L,L,L,L,L,K,L,K,L
I,8536,3973,"13117355",寶旺機械股份有限公司,桃園市,桃園市新屋區新華路１段１５４號,"03-497-0929",J,A,E,A,C,A,D,A,E,A
I,8536,3974,"86753422",晟合貿易有限公司,臺北市,臺北市松山區中崙里八德路二段４００號１０樓之１,"02-2778-3101",L,M,L,L,L,M,L,M,L,L
I,8536,3975,"22619766",協勇國際實業股份有限公司,台北巿,台北巿信義區基隆路２段１１１號９樓,"02-27393357",K,L,K,L,K,L,K,L,J,L
I,8536,3976,"89639679",晶廣企業有限公司,新北市,新北市永和區永利路７巷４弄９號４樓,"02-29487634",L,M,L,L,K,M,L,L,L,L
I,8536,3977,"22060044",亨將精密工業股份有限公司,彰化縣,彰化縣鹿港鎮鹿工北二路１８號,"04-7810727",L,I,L,E,L,D,L,D,L,F
I,8536,3978,"42616507",初品股份有限公司,臺北市,臺北市中山區民生東路２段１２２號　,"0225233233",L,M,L,L,L,K,L,L,L,L
I,8536,3979,"53651425",香港商聯寶電腦有限公司台灣分公司,臺北市,臺北市中山區北安路７８０號７樓　,"02-27186555",H,L,D,L,G,L,G,L,G,M
I,8536,3980,"80233419",岦昌企業股份有限公司,高雄市,高雄市大社區中里里文化路２６之４號１樓,"08-7882666",L,L,K,L,L,H,L,I,K,L
I,8536,3981,"28727088",振罡科技有限公司,新北市,新北市汐止區大同路３段１９６之５號８樓,"02-86472689",L,L,K,L,L,L,L,L,L,L
I,8536,3982,"12209460",惠晟股份有限公司,新北市,新北市土城區忠承路１１７號１１樓,"02-22685099",L,J,L,G,L,F,L,G,L,G
I,8536,3983,"16824894",俐龍儀器有限公司,高雄市,高雄市前鎮區民壽街３０號１樓,"07-5376288",L,L,L,L,L,M,L,M,L,L
I,8536,3984,"86139123",全士達實業有限公司,台北巿,台北巿大安區和平東路３段３０８巷６６號１樓,"02-2377-2251",L,J,L,G,K,C,K,E,K,F
I,8536,3985,"23586074",利得儀器股份有限公司,新北市,新北市中和區建一路１８６號１６樓之３,"02-8227-2200",J,M,I,L,I,L,I,L,J,L
I,8536,3986,"16453871",立新國際開發股份有限公司,高雄市,高雄市小港區高坪二十九路１２號１樓　,"07-7880066",L,M,L,M,L,M,L,M,L,M
I,8536,3987,"29098235",歷得科技股份有限公司,新竹縣,新竹縣竹北市保泰三路７８號　　,"03-6591888",L,L,L,L,L,L,L,M,L,M
I,8536,3988,"55645526",勝源機械股份有限公司,臺中市,臺中市大肚區社腳里沙田路一段６６２巷２０號,"04-26937599",L,F,L,A,K,A,L,A,L,A
I,8536,3989,"80091967",力得科技有限公司,新竹縣,新竹縣竹北市嘉豐二街１段１６號１樓,"(03)5505696",L,M,L,M,L,L,L,M,K,M
I,8536,3990,"16887406",賀喜能源股份有限公司,苗栗縣,苗栗縣頭份鎮工業路１０１號,"037-612219",L,L,L,L,L,L,H,L,I,L
I,8536,3991,"54677227",立宇生活科技有限公司,臺北市,臺北市大同區承德路１段８號３樓之１　,"02-25592500",L,M,M,M,M,M,M,M,M,M
I,8536,3992,"22325002",麗臺科技股份有限公司,新北市,新北市中和區建一路１６６號１８樓,"02-82265800",B,E,A,A,A,A,A,A,A,A
I,8536,3993,"28922723",領威國際發展股份有限公司,新北市,新北市淡水區中正東路２段２９之５號９樓,"02-28090180",L,J,L,J,L,J,L,J,L,I
I,8536,3994,"07663290",力麗企業股份有限公司,臺北巿,臺北巿中山區松江路１６２號１１樓,"02-21001188",E,A,A,A,C,A,C,A,A,A
I,8536,3995,"61438308",立明板金股份有限公司,臺中市,臺中市豐原區南嵩里北陽路３８９之２號,"04-25121169",L,M,L,M,L,M,L,M,M,M
I,8536,3996,"89228654",領眾科技股份有限公司,新北市,新北市板橋區廣權路１３號４樓,"02-29629092",L,L,L,M,L,L,L,L,L,M
I,8536,3997,"13019761",利創國際有限公司,新北市,新北市新莊區新泰路２２９號１０樓之１,"02-29937331",L,M,L,M,L,M,L,M,L,M
I,8536,3998,"42939627",黎巴嫩商瑪帝聯海外股份有限公司台灣分公司,新竹市,新竹市東區綠水里光復路二段295號14樓之5,"03-5744591",L,L,L,L,L,K,M,M,M,M
I,8536,3999,"84638519",力志興業有限公司,新北市,新北市泰山區明志路一段３５２巷２８號,"02-22972109",L,L,L,L,L,L,L,L,L,L
I,8536,4000,"24691308",樂智電子有限公司,新北市,新北市樹林區中山路１段１５５號８樓之２,"02-86751524",L,M,L,M,L,M,L,M,L,M
I,8536,4001,"86381181",台灣力可儀器股份有限公司,台北巿,台北巿民生東路二段１７０號７樓,"02-25184699",L,M,K,M,L,M,L,M,L,M
I,8536,4002,"84309397",台灣力克系統股份有限公司,桃園市,桃園市龜山區民生北路一段３８之１號２樓,"(03)326-7210",L,L,L,L,L,L,L,L,L,L
I,8536,4003,"28924406",李力技術工程有限公司,桃園市,桃園市平鎮區復興里廣德街２３８巷１號１樓,"03-4921900",L,M,L,M,L,M,L,M,L,M
I,8536,4004,"34062270",協人企業股份有限公司,新北市,新北市土城區中興路１５號,"02-22684751",L,L,L,L,L,M,L,L,L,L
I,8536,4005,"23873786",立勇實業股份有限公司,雲林縣,雲林縣斗六市科加路２號,"05-5518689",L,D,L,A,L,A,L,A,L,A
I,8536,4006,"54078948",立固興業有限公司,台南市,台南市永康區東橋一路３５８號一樓,"06-2535366",L,L,L,K,L,K,M,L,L,K
I,8536,4007,"23629799",立信企業有限公司,新北市,新北市汐止區民族六街２１號４樓,"02-26924083",L,M,L,M,M,M,M,M,L,M
I,8536,4008,"09418560",歐技有限公司,臺北巿,臺北巿中山區長春路４０號６樓之１０,"02-25623656",L,L,L,L,L,L,L,L,L,L
I,8536,4009,"80280670",聯通國際集運有限公司,基隆市,基隆市七賭區明德二路１５之４６號８樓,"02-27483453",L,M,L,M,L,M,L,M,M,M
I,8536,4010,"51162111",香港商徠卡大中華相機有限公司台灣分公司,臺北市,臺北市大安區敦化南路二段９７號２樓,"02-87922628",K,M,G,M,I,M,G,L,M,M
I,8536,4011,"22162247",珉恆股份有限公司,新北市,新北市新店區德正街２７巷２９弄６５號１樓,"02-29185320-3",L,M,L,L,L,L,L,L,L,L
