I,8536,5929,"27256150",日商視科網有限公司台灣分公司,新北市,新北市中和區中正路７００號９樓之１、之２,"02-82280520",L,K,L,J,L,J,L,I,L,I
I,8536,5930,"80724457",弘杰國際企業有限公司,新北市,新北市永和區保生路１號１１樓之２,"02-22312808",L,M,L,M,L,M,L,L,L,L
I,8536,5931,"80298284",寶鯨實業有限公司,臺北市,臺北市大安區復興南路一段２９５巷１３弄２號１樓,"02-27086703",L,M,L,L,L,M,L,M,L,M
I,8536,5932,"69643181",邁可威科技股份有限公司,桃園市,桃園市蘆竹區中興路９８號,"03-3132071",L,L,L,L,L,L,L,L,M,M
I,8536,5933,"54605364",翼樺系統有限公司,臺中市,臺中市北區賴興里永定一街34號1樓,"04-22912202",L,M,L,M,L,M,L,M,L,M
I,8536,5934,"30885127",天網電子股份有限公司,臺北巿,臺北巿成功路一段七十六．七十八．八十號４樓,"02-27882403",J,E,G,A,G,A,G,A,G,A
I,8536,5935,"16128192",元泰發實業有限公司,高雄巿,高雄巿苓雅區林西街１１７巷１５號１樓,"07-7517451",L,L,L,K,J,K,K,K,I,K
I,8536,5936,"54034267",震昇科技企業股份有限公司,新北市,新北市新店區中正路５３８巷１２號５樓,"02-86675288",K,M,H,M,J,M,J,M,J,M
I,8536,5937,"28158516",天頻科技有限公司,新北市,新北市中和區橋安街２５號７樓,"02-22441157",L,M,M,M,L,M,M,M,M,M
I,8536,5938,"12737841",追日潤股份有限公司,新竹市,新竹市東區光復路２段２８７號１２樓,"03-5163636",A,I,A,I,A,I,A,J,A,I
I,8536,5939,"54722834",泰永生物科技股份有限公司,新北市,新北市三重區光復路一段６１巷２６號２樓之１,"02-29993395",L,M,K,M,J,M,K,M,J,M
I,8536,5940,"16543471",省力機電實業有限公司,臺中市,臺中市大里區德昌一街３２號１樓,"04-22128633",L,M,L,L,L,M,M,M,L,L
I,8536,5941,"30878126",通懋實業股份有限公司,臺北巿,臺北巿內湖區陽光街３２１巷８號５樓,"02-26562758",L,M,L,M,I,M,G,M,F,M
I,8536,5942,"12952545",亞德儀器有限公司,臺北市,臺北市中正區金山北路１號５樓,"02-23956166",L,M,L,M,L,M,L,M,L,M
I,8536,5943,"28746732",速碼波科技股份有限公司,新竹縣,新竹縣竹北市台元二街１號３樓之５　,"03-5601363",L,L,L,L,L,K,L,K,K,J
I,8536,5944,"80247011",新基科技股份有限公司,新北市,新北市新店區中正路４９３號１０樓,"02-22186886",L,J,L,G,L,G,L,G,L,F
I,8536,5945,"70665900",永翊泰股份有限公司,桃園市,桃園市中壢區中山路１３６號８樓,"03-4266176",H,L,E,L,D,L,D,L,A,M
I,8536,5946,"60256928",電威電機工廠股份有限公司,彰化縣,彰化縣溪湖鎮河東里二溪路２段橋北巷２０號,"048-812166",L,J,L,I,L,G,L,I,L,I
I,8536,5947,"53666124",英屬開曼群島商世邁科技股份有限公司台灣分公司,新北市,新北市板橋區遠東路１號６樓,"02-77052700",L,M,L,M,L,M,L,M,L,L
I,8536,5948,"61813090",聰明媽咪國際股份有限公司,臺中市,臺中市北區健行里中清路一段３１７之１號,"04-22083939",L,M,K,M,K,M,L,M,M,M
I,8536,5949,"42962247",英屬維京群島商拓瑪仕有限公司台灣分公司,桃園市,桃園市桃園區中埔二街186號9樓,"03-3017651",L,M
I,8536,5950,"28106784",連智科技有限公司,桃園市,桃園市桃園區龍鳳里國強一街２７５號１２樓之１,"03-2171511",L,M,L,M,L,M,L,M,L,M
I,8536,5951,"80258993",智慧光科技股份有限公司,基隆市,基隆市七堵區工建路２之１號,"02-24525100",J,E,I,A,I,C,H,A,J,D
I,8536,5952,"13044754",智星科技股份有限公司,新北市,新北市中和區中正路７３８號１３樓之１,"02-82262008",L,M,L,M,L,M,L,M,L,M
I,8536,5953,"42894641",摩士智能股份有限公司,臺中市,臺中市后里區公館里安眉路８２之１３０號,"04-25580566",K,J,I,G,K,J,M,M,M,M
I,8536,5954,"23525696",速睦喜股份有限公司,桃園市,桃園市蘆竹區內厝里南山路二段205巷16號,"03-3223443",A,M,A,M,A,L,A,L,A,L
I,8536,5955,"12373320",香港商史麥威有限公司台灣分公司,台北市,台北市松山區復興北路１號９樓之４,"02-8771-3347",L,L,L,L,L,L,L,L,L,L
I,8536,5956,"28665169",仕鑫有限公司,新北市,新北市土城區中央路３段２８１巷１１弄７號５樓,"02-22681593",L,M,L,M,L,M,L,M,L,M
I,8536,5957,"96979048",艾斯艾姆開股份有限公司,臺北市,臺北市中山區松江路８７號１２樓之２,"02-2518-3649",J,L,H,L,G,M,G,L,E,M
I,8536,5958,"60266691",舜繹國際企業有限公司,臺中市,臺中市北屯區松竹北二街４７號１樓,"04-22472696",L,M,L,M,L,M,L,M,M,M
I,8536,5959,"80336956",英屬蓋曼群島商虹揚國際科技有限公司台灣分公司,桃園市,桃園市桃園區中正路１０７１號１４樓之５,"03-3252225",K,L,E,F,J,I,L,L,M,L
I,8536,5960,"27258354",新加坡商實耐寶股份有限公司台灣分公司,新北市,新北市新莊區五權一路９號３樓之４,"02-22989789",L,M,J,M,J,M,J,M,J,M
I,8536,5961,"28468435",森格科技有限公司,新北市,新北市中和區板南路６５３號１４樓,"02-22253259",L,M,I,M,J,M,J,M,K,M
I,8536,5962,"28081192",翔光照明電器股份有限公司,新北市,新北市新莊區中正路６５１之６號９樓,"03-3979592",L,M,J,M,J,M,J,M,J,M
I,8536,5963,"22182927",上揚科技股份有限公司,新北市,新北市汐止區中興路３２號,"02-26918000",J,K,J,L,K,K,L,K,L,K
I,8536,5964,"11825655",台歐企業股份有限公司,台北巿,台北巿中山北路二段１１２號３樓,"02-25413253",L,E,L,A,L,A,L,A,L,A
I,8536,5965,"52579072",和和機械股份有限公司,臺中市,臺中市南屯區精科東路３號,"04-23591888",L,D,K,A,J,A,J,A,J,A
I,8536,5966,"97164149",台灣蘇比克股份有限公司,桃園市,桃園市龜山區科技一路２６號,"03-328-9885",L,M,K,M,K,L,K,M,K,L
I,8536,5967,"22573240",樺鈺國際股份有限公司,臺中市,臺中市北屯區松順一街２９號４樓　,"04-22454928",L,M,L,M,L,M,L,L,L,M
I,8536,5968,"84101621",崧競科技股份有限公司,新北市,新北市汐止區康寧街169巷29之1號8樓,"02-26923535",L,L,L,K,L,J,L,J,L,J
I,8536,5969,"24629683",碩勤應用材料有限公司,新竹市,新竹市北區竹光路９５巷２１弄１６號７樓,"03-5351019",L,M,L,L,M,L,M,M,M,L
I,8536,5970,"43787872",光洋應用材料科技股份有限公司,臺南市,臺南市安南區工業三路１號　　　　,"06-5110123",A,A,A,A,A,A,A,A,A,A
I,8536,5971,"50866041",台灣所樂太陽能科技股份有限公司,臺北市,臺北市信義區基隆路１段２００號４樓,"02-77253685",L,M,L,M,L,M,M,M,M,M
I,8536,5972,"23336409",景胤股份有限公司,雲林縣,雲林縣斗六市鎮西里雲林路二段471號,"05-5344013",M,M,L,M,L,M,M,M,L,M
I,8536,5973,"50939298",固態電子設備有限公司,高雄市,高雄市鳳山區武營路２６４巷１５號,"07-2211832",L,L,L,L,M,M,M,M,M,M
I,8536,5974,"16766959",鑫創科技股份有限公司,新竹縣,新竹縣竹北市台元街２２號５樓之１,"886-3-552-6568",J,G,H,A,L,A,J,A,K,A
I,8536,5975,"97452346",汛捷科技有限公司,新竹縣,新竹縣竹北市光明九路１８０之３號１樓,"03-656-6996",L,L,L,L,L,L,L,L,L,L
I,8536,5976,"80130645",延碩系統股份有限公司,新北市,新北市三重區重新路５段６０９巷４號８樓之３　　,"02-2999-5175",L,M,L,L,L,L,L,L,L,L
I,8536,5977,"23640801",所羅門股份有限公司,臺北市,臺北市內湖區行忠路４２號６樓,"02-87918989",I,K,F,J,D,I,D,H,C,H
I,8536,5978,"86528544",洋健企業股份有限公司,桃園市,桃園市平鎮區建安里平東路１段１７８巷３０號１樓,"03-4506580",L,M,L,L,L,M,L,L,L,L
I,8536,5979,"16377261",索羅爾企業有限公司,台中市,台中市西屯區大恩街１３號１樓,"04-23100231",L,L,M,L,L,M,L,M,L,M
I,8536,5980,"86834614",崧騰企業股份有限公司,桃園市,桃園市桃園區經國路８８８號７樓之２，７樓之３,"03-3162168",K,J,J,I,J,H,J,I,L,I
I,8536,5981,"70717174",捷騰光電股份有限公司,桃園市,桃園市蘆竹區經國路８９８號１３樓,"03-3168682",L,I,K,F,K,G,L,H,L,I
I,8536,5982,"54804841",常陽科技股份有限公司,雲林縣,雲林縣斗六市雲科路三段３７號,"05-5511017",L,J,L,E,L,G,L,F,L,G
I,8536,5983,"80385175",承德電子股份有限公司,高雄市,高雄市前鎮區建華街１４巷１０弄５號１樓,"07-7529323",K,M,J,M,I,M,I,M,I,M
I,8536,5984,"12616070",矽原精密電子股份有限公司,臺南市,臺南市永康區中正三街４８６巷５０號,"06-2427963",L,K,L,J,L,J,L,I,L,I
I,8536,5985,"29087933",貫鼎科技股份有限公司,新竹縣,新竹縣湖口鄉中正村中正路二段２０３巷９號,"03-5999160",L,L,L,L,L,K,L,K,L,L
I,8536,5986,"23076369",上耕企業有限公司,桃園市,桃園市楊梅區永寧里４鄰校前路３８９號,"03-4758671",L,M,L,L,L,L,L,L,L,L
I,8536,5987,"86146362",璞石科技股份有限公司,新北市,新北市三重區重新路四段６５號３樓之４,"02-29837348",K,M,J,M,J,M,J,M,J,L
I,8536,5988,"80311934",神迅科技股份有限公司,新北市,新北市土城區忠承路８５號１０樓,"02-22683698",L,M,L,M,L,M,L,M,L,M
I,8536,5989,"33923363",松川精密股份有限公司,新北市,新北市樹林區中華路377號,"02-86845332",E,A,A,A,E,A,A,A,C,A
I,8536,5990,"85611896",松和工業股份有限公司,南投縣,南投縣南投巿南崗三路六十一號,"049-2253551",F,E,A,A,A,A,A,A,A,A
I,8536,5991,"86648344",松協企業股份有限公司,桃園市,桃園市蘆竹區南崁路二段２２８巷９８號,"03-3110081",L,I,K,E,L,F,L,G,L,I
I,8536,5992,"13178541",松日有限公司,高雄市,高雄市鼓山區鼓山一路５３之１２號,"07-5518170",L,L,L,L,L,L,L,M,L,M
I,8536,5993,"84325018",松浴有限公司,高雄巿,高雄巿鼓山區鼓山一路５３–８號,"07-5318675",L,L,L,L,L,L,L,L,L,L
I,8536,5994,"12874555",尚之宇有限公司,臺北市,臺北市士林區大南路３６９號５樓,"02-28825522",L,M,L,M,L,M,L,M,L,M
I,8536,5995,"27797085",松金科技有限公司,桃園市,桃園市平鎮區廣興里育達路８２號１樓,"03-4926117",L,M,L,M,L,M,L,M,L,M
I,8536,5996,"80630254",嵩林科技股份有限公司,桃園市,桃園市桃園區永安路４０３巷１３號８樓,"03-3761600",L,L,L,L,L,L,L,L,L,L
I,8536,5997,"84800723",辰尚企業有限公司,新北市,新北市中和區中正路七三八號十六樓之七,"22315411",L,K,L,H,L,I,L,I,L,I
I,8536,5998,"86399963",嵩台資訊股份有限公司,新北市,新北市鶯歌區二甲路９３之１號,"02-26777840",K,I,K,G,K,E,J,D,J,A
I,8536,5999,"89376535",松河電機企業股份有限公司,屏東縣,屏東縣屏東市和生路三段１００１號,"08-7559933",L,K,L,J,L,I,L,I,L,I
I,8536,6000,"80644454",台灣所立克有限公司,臺中市,臺中市大雅區文雅里中和路２３０巷８號,"04-25600860",K,G,I,A,J,A,I,A,J,D
I,8536,6001,"70832512",致電有限公司,新北市,新北市中和區連城路３８９巷１５號１樓,"02-22232805",L,L,L,L,L,L,L,M,L,M
I,8536,6002,"28958735",靖展國際有限公司,桃園市,桃園市桃園區大有路１７３號１４樓,"03-3314330",J,L,G,L,G,L,E,L,K,L
I,8536,6003,"23882125",昇騰國際有限公司,新北市,新北市汐止區南陽街１１７號３樓,"02-86951168",L,M,L,M,L,M,L,M,L,M
I,8536,6004,"25118815",台灣索諾瓦有限公司,新北市,新北市中和區板南路６６１號４樓,"02-22216722",J,M,H,M,H,M,I,L,I,M
I,8536,6005,"23529362",台灣索尼股份有限公司,臺北市,臺北市中山區中山北路２段４２號５樓,"02-25228545",A,A,A,A,A,A,A,A,A,A
I,8536,6006,"86825636",順博汽車材料有限公司,基隆巿,基隆巿七堵區實踐路６８號１樓,"02-24514416",L,M,L,M,L,M,L,M,L,M
I,8536,6007,"89618745",舒霖有限公司,臺北巿,臺北巿松山區復興南路一段１號７樓,"02-27412000",L,M,L,M,L,M,L,L,L,M
I,8536,6008,"89351154",順泰電子科技股份有限公司,臺南市,臺南市永康區環工路４３號１樓,"06-2016969",L,J,L,H,L,H,L,H,L,G
I,8536,6009,"53602810",健順科技股份有限公司,桃園市,桃園市桃園區國聖一街１７７之５巷１８號,"",L,M,L,M,L,M,L,M,L,M
I,8536,6010,"97013749",手普系統股份有限公司,新北市,新北市新店區寶橋路２３５巷１１號８樓,"02-29156310",L,M,M,M,M,M,M,M,M,M
I,8536,6011,"24336700",世曉國際有限公司,臺北市,臺北市內湖區民權東路６段１８０巷６號１０樓之１９,"02-27929007",L,M,L,M,L,M,L,M,L,M
I,8536,6012,"16160002",崇登股份有限公司,臺北巿,臺北巿大安區光復南路６３４號４樓,"02-27007538",L,M,L,M,L,M,L,M,L,M
I,8536,6013,"66803613",創新影音發展有限公司,新北市,新北市中和區中正路736號4樓,"02-82280012",L,L,L,L,L,L,M,M,M,M
I,8536,6014,"04750638",科音國際股份有限公司,桃園市,桃園市龜山區科技一路３２號,"03-3961958",J,C,G,A,F,A,F,A,F,A
I,8536,6015,"22339940",上瑞電子企業有限公司,台北巿,台北巿建國南路一段２８０號４樓,"02-27040506",L,L,L,L,L,L,L,L,L,L
I,8536,6016,"28290819",駿容實業有限公司,高雄市,高雄市左營區博愛三路８號９樓之２,"07-3479296",L,M,L,M,L,M,L,M,L,M
I,8536,6017,"84149792",索爾思光電股份有限公司,新竹縣,新竹縣新竹科學工業園區寶山鄉園區二路４６號,"03-5169222",A,A,A,A,A,A,A,A,A,A
I,8536,6018,"24740292",南方科技股份有限公司,臺北市,臺北市信義區和平東路３段２２５號１０樓之１,"02-27366120",L,M,L,M,L,M,L,M,L,M
I,8536,6019,"96867944",群田工業有限公司,彰化縣,彰化縣田中鎮斗中路１段３１０巷８６號,"04-8755598",L,M,K,M,J,M,H,M,F,M
I,8536,6020,"28425197",賽普勒斯商司威歐有限公司台灣分公司,臺北市,臺北市文山區景福街３９號,"02-29301196",L,J,L,G,L,H,L,I,L,J
I,8536,6021,"12686076",閎奕國際室內裝修股份有限公司,臺北市,臺北市松山區復興北路１８１號５樓之４,"02-27180961",L,M,L,L,L,M,L,M,L,M
I,8536,6022,"97095544",弘宇資訊股份有限公司,臺北市,臺北市中山區南京東路３段９１號１１樓之２,"02-25014488",M,M,L,M,L,L,L,M,M,M
I,8536,6023,"86207022",泓佳有限公司,台中巿,台中巿北屯區崇德六路３２號３樓之１,"04-22443080",L,M,L,M,L,M,L,M,L,M
I,8536,6024,"23929888",台灣思百吉股份有限公司,臺北市,臺北市松山區民生東路３段１２８號１３樓之１,"02-25462988",G,M,A,L,C,L,F,M,F,L
I,8536,6025,"23866949",宣德科技股份有限公司,桃園市,桃園市龜山區民生北路１段５６８號,"03-2120088",D,A,A,A,I,A,K,A,L,A
I,8536,6026,"22318749",創技工業股份有限公司,新竹縣,新竹縣湖口鄉新竹工業區光復南路五十六號,"03-5983411",J,H,F,A,H,A,F,A,H,B
I,8536,6027,"53315232",台灣迅聯通信股份有限公司,新北市,新北市林口區過崙街８２號及８２號２樓,"02-26086236",K,M,J,M,D,M,D,M,C,M
I,8536,6028,"86159422",耀新電子股份有限公司,台北市,台北市松山區南京東路５段３３６號５樓之４,"03-4383138",K,A,I,A,K,A,J,A,J,A
I,8536,6029,"12146000",華王貿易有限公司,臺北市,臺北市松山區復興北路３６９號８樓之７,"02-27131133",K,K,J,I,I,J,I,K,I,L
I,8536,6030,"84394008",廷翰國際有限公司,基隆巿,基隆巿七堵區綠葉街１５號１樓,"02-24508440",L,L,L,L,L,L,L,L,L,L
I,8536,6031,"16085953",耀巍股份有限公司,新竹巿,新竹巿勝利路２２７號１樓,"03-5250345",L,M,J,M,J,M,J,M,J,M
I,8536,6032,"22729784",蔚華科技股份有限公司,新竹市,新竹市水源街９５號,"03-5738099",I,K,A,L,A,L,A,L,A,K
I,8536,6033,"29180620",晶彩亞太科技有限公司,新北市,新北市新店區民權路１００號１１樓之１,"02-22188532",L,J,J,G,K,I,L,I,L,L
I,8536,6034,"97491093",耕興股份有限公司,新北市,新北市汐止區新台五路一段１０６號６樓,"02-26962468",I,J,F,I,I,J,F,J,G,J
I,8536,6035,"24455825",春滿育樂機械科技有限公司,臺北市,臺北市松山區八德路３段２００號７樓,"02-25771237",M,M,L,M,L,M,L,M,L,M
I,8536,6036,"30923516",春園股份有限公司,台北巿,台北巿和平東路三段２９３號一樓,"02-27327151",L,M,K,M,J,M,J,M,J,M
I,8536,6037,"79963401",億虹電機有限公司,新北市,新北市汐止區東勢街二○一巷三五八號,"02-2691-3266",L,M,L,L,L,L,L,L,M,L
I,8536,6038,"42755556",住微科技有限公司,新竹市,新竹市公道五路二段１２０號１０樓之１　　,"",L,M,L,L,L,M,K,M,L,M
I,8536,6039,"28063309",住程科技系統有限公司,新竹市,新竹市東區公道五路２段１２０號１０樓之１,"03-5753105",J,M,H,L,H,L,I,L,H,L
I,8536,6040,"53813456",永嘉雙龍汽車股份有限公司　,臺中市,臺中市北屯區崇德路三段６１８號２樓,"04-24224451",K,M,G,M,H,M,H,M,I,M
I,8536,6041,"28338594",桑得有限公司,臺中市,臺中市北屯區崇德十路一段４１５號１樓,"04-23829980",L,M,K,M,L,M,L,M,L,M
I,8536,6042,"53467504",思銳生醫科技股份有限公司,新北市,新北市新店區北新路三段２１７號１１樓,"02-89146649",L,L,L,L,L,K,L,L,L,K
I,8536,6043,"70838614",台灣新鈳電子股份有限公司,台北市,台北市民生西路３巷９號６樓,"(02)2521-6388",J,K,K,K,K,L,I,L,I,L
I,8536,6044,"23694968",茂發電子股份有限公司,臺南市,臺南市新市區臺南科學工業園區環東路１段３１巷１８號１樓,"06-5051588-263",L,F,G,D,L,J,L,K,L,K
I,8536,6045,"53985160",勝棠國際股份有限公司,新北市,新北市板橋區信義路２７９巷１號２樓,"02-89513323",J,M,H,M,H,M,I,M,I,M
I,8536,6046,"09442837",幕後企業有限公司,新北市,新北市新店區復興路５１之７號４樓,"02-86671011",L,M,L,M,L,M,L,M,L,M
I,8536,6047,"25120468",瀚騰科技股份有限公司,臺北市,臺北市內湖區新湖二路５０號,"02-27933368",L,L,L,L,L,K,L,K,L,M
I,8536,6048,"22238226",宏奇泵浦工業有限公司,新北市,新北市新莊區中原東路２３號,"02-29931465-6",J,A,F,A,E,A,E,A,E,A
I,8536,6049,"22585652",伍全企業股份有限公司,桃園市,桃園市中壢區新北園路２０號,"03-4522764",J,K,I,J,H,J,H,J,H,J
I,8536,6050,"89716963",恆勤貿易股份有限公司,臺中市,臺中市神岡區庄前里神林路９０巷１３號２樓,"04-25615349",L,M,L,M,L,M,L,M,L,M
I,8536,6051,"69920256",穆龍貿易有限公司,臺南市,臺南市永康區西灣里永華路３７８號一樓,"06-2720271",L,L,L,K,L,J,L,J,L,K
I,8536,6052,"36501387",立全尚業有限公司,臺北市,臺北市大安區富陽街１２３號,"06-3311742",L,M,L,M,L,M,L,M,L,M
I,8536,6053,"22412940",正規電線電纜工業股份有限公司,臺南市,臺南市新市區國際路１６號,"06-5995221",L,G,K,A,L,A,L,A,L,C
I,8536,6054,"28339643",江楠企業有限公司,臺中市,臺中市大肚區王田里興和路２１１號１樓,"04-26930033",L,M,L,M,L,M,L,M,L,M
I,8536,6055,"22035355",元璋玻璃股份有限公司,基隆巿,基隆巿安樂區武訓街４０號,"02-24321288",L,J,L,I,K,I,L,I,K,J
I,8536,6056,"12606952",思達科技股份有限公司,新竹市,新竹市公道五路二段101號2樓之1,"03-5717179",G,I,A,A,A,A,A,C,A,E
I,8536,6057,"27945086",星元電力股份有限公司,臺北市,臺北市內湖區瑞光路３９２號６樓,"02-87982000",K,M,J,M,H,M,F,L,A,M
I,8536,6058,"28986660",燦星網通股份有限公司,臺北市,臺北市內湖區堤頂大道1段333號6樓,"02-2795-6898",L,M,J,M,J,M,I,M,I,M
I,8536,6059,"84415854",石大股份有限公司,桃園市,桃園市龜山區頂湖二街７３號,"03-3971878",L,L,K,K,K,K,K,K,J,K
I,8536,6060,"70783765",星能電力股份有限公司,彰化縣,彰化縣線西鄉塭仔村線工南二路２號,"02-87521516",L,M,E,M,K,M,A,M,A,M
I,8536,6061,"53477720",特申有限公司,臺中市,臺中市潭子區頭家里和平路１４２之１３號,"04-25349219",L,L,K,L,L,L,L,L,L,L
I,8536,6062,"22049490",新上實業有限公司,台北巿,台北巿松江路１５２號１１樓２室,"02-25423816",L,J,L,H,L,H,L,G,L,G
I,8536,6063,"22318781",中日龍股份有限公司,臺北巿,臺北巿士林區中正路１２０號７樓,"02-28346295",L,L,K,L,K,L,K,L,L,L
I,8536,6064,"70659718",訊尉科技有限公司,彰化縣,彰化縣彰化市中山路１段１１９巷７２號１樓,"04-7513768",L,M,K,M,L,M,L,M,K,M
I,8536,6065,"69533699",勢得科研股份有限公司,臺北市,臺北市信義區基隆路１段１５５號１３樓之５,"03-3185032",L,M,L,L,L,L,L,M,M,M
I,8536,6066,"96981348",星船音響工程有限公司,臺北市,臺北市萬華區環河南路２段５０巷１５號１樓,"02-29009898",L,M,L,M,L,M,L,M,K,M
I,8536,6067,"22360154",永旭股份有限公司,台北市,台北市中山區林森北路３７２號４樓,"02-2521-6001",L,K,K,H,J,J,J,K,K,K
I,8536,6068,"96858369",光界科技有限公司,新北市,新北市樹林區三龍街１１８巷２３號,"02-26882388",L,M,L,M,L,L,L,M,L,M
I,8536,6069,"52504122",瑞溍科技有限公司,臺北市,臺北市中山區錦州街４６號９樓之１　　　,"07-5216800",L,M,K,L,L,L,M,M,M,M
I,8536,6070,"22637722",綜元股份有限公司,新北市,新北市三重區重新路５段６０９巷２０號８樓之１,"02-29992234",L,M,L,L,K,L,K,L,K,L
I,8536,6071,"70793047",香港商史陶比爾股份有限公司台灣分公司,臺中市,臺中市西區民生北路１５１號１樓,"04-23050676",K,M,J,M,J,M,K,M,K,L
I,8536,6072,"80724082",旭源科技自動化有限公司,臺南市,臺南市佳里區佳里興５７０號,"06-7260076",L,L,J,I,L,L,L,L,K,L
I,8536,6073,"28089244",展威國際有限公司,桃園市,桃園市龜山區復興一路３３６號２樓,"03-3187665",L,M,L,L,L,L,L,L,L,M
I,8536,6074,"12824731",展威機械有限公司,桃園市,桃園市龜山區復興一路３３６號２樓,"03-3180900",L,K,L,J,L,J,L,I,M,J
I,8536,6075,"54174674",原沁科技有限公司,新北市,新北市新店區中興路一段２６號,"0911-430543",L,M,L,M,L,M,L,M,L,M
I,8536,6076,"80161490",太盛餐飲事業股份有限公司,新北市,新北市蘆洲區集賢路336巷2號(1樓),"02-26187136",L,M,K,M,K,M,K,M,L,M
I,8536,6077,"70848850",新盛力科技股份有限公司,高雄市,高雄市前鎮區高雄加工出口區西十五街１號,"",A,A,A,A,A,A,A,A,A,A
I,8536,6078,"97468918",十圖企業有限公司,臺北市,臺北市士林區忠誠路１段１７３巷１６號,"02-2831-9776",K,M,J,M,J,M,J,M,J,M
I,8536,6079,"13170132",策評科技有限公司,高雄市,高雄市左營區政德路５８９號,"07-3434196",L,M,K,M,K,M,K,M,K,M
I,8536,6080,"28396762",水村電有限公司　,臺中市,臺中市大里區慈德路３１０巷１１號,"04-24915488",L,L,L,L,L,L,L,L,L,L
I,8536,6081,"80366114",建佳科技股份有限公司,高雄市,高雄市路竹區路科二路６９號２樓　,"07-6955520#13",L,L,L,L,L,L,L,M,L,M
I,8536,6082,"70527203",明躍國際健康科技股份有限公司,彰化縣,彰化縣埔心鄉瓦北村瑤鳳路一段３９８號,"048-299998",K,E,D,A,K,A,L,A,L,A
I,8536,6083,"22765253",美商史賽克（遠東）有限公司台灣分公司,臺北市,臺北市中正區羅斯福路２段１００號５樓之１,"02-2367-3088",I,M,C,M,B,M,F,M,G,M
I,8536,6084,"12462174",新駿實業股份有限公司,新北市,新北市五股區中興路１段１６８號,"02-2983-7622",L,J,L,E,L,E,L,C,L,E
I,8536,6085,"22379463",屬治有限公司,臺南巿,臺南巿東區崇德九街廿一號,"06-2684388",L,M,L,M,L,M,L,M,L,L
I,8536,6086,"12980704",台灣速霸陸股份有限公司,桃園市,桃園市中壢區永福里東園路３８之２號,"02-27901818",I,M,A,M,D,L,G,L,H,L
I,8536,6087,"27483388",修研電子有限公司,新北市,新北市中和區連城路１６８號３樓,"02-77289568",L,J,K,F,J,G,J,E,J,F
I,8536,6088,"16638110",旭德科技股份有限公司,新竹縣,新竹縣湖口鄉湖南村光復北路８號,"03-5986150",E,A,A,A,A,A,A,A,A,A
I,8536,6089,"07671974",必成精機股份有限公司,新北市,新北市新店區寶高路７６號４樓,"02-29180567",L,M,L,L,L,M,L,M,L,M
I,8536,6090,"22099786",卓越成功股份有限公司,苗栗縣,苗栗縣竹南鎮新竹科學工業園區科中路１１號２樓,"037-586999",K,J,J,H,H,F,A,A,C,B
I,8536,6091,"28320763",瑞洲電裝股份有限公司,新北市,新北市新莊區中正路７２１巷８號１樓,"02-29028588",J,L,H,L,I,L,I,L,I,L
I,8536,6092,"20850015",美商壽力有限公司台灣分公司,新北市,新北市林口區中山路２４８號３樓之１,"02-26013500",L,M,J,M,J,L,J,L,I,M
I,8536,6093,"70368155",升齊科技股份有限公司,新北市,新北市新店區民權路９５號７樓之２　,"02-86671667",L,M,K,M,J,M,K,L,K,L
I,8536,6094,"70848177",住華科技股份有限公司,臺南市,臺南市善化區環東路2段32號,"06-5053456",A,A,A,A,A,A,A,A,A,A
I,8536,6095,"23525865",台灣住倉股份有限公司,臺北市,臺北市中山北路二段１２９號８樓之３,"02-2511-3133",L,M,L,M,K,M,J,M,L,M
I,8536,6096,"53812533",住友重機械精密科技股份有限公司,新竹市,新竹市東區公園路２１６巷３號４樓,"",K,M,J,M,J,M,K,L,J,M
I,8536,6097,"23930695",台灣住友商事股份有限公司,臺北巿,臺北巿松山區敦化北路２６０號８樓,"02-27158903",G,L,A,K,A,J,A,J,A,J
I,8536,6098,"11675706",森美工程股份有限公司,臺北市,臺北市大安區仁愛路４段４１２號１２樓,"02-27052032",L,M,L,M,K,M,L,M,J,M
I,8536,6099,"20980951",成煒企業有限公司,臺北市,臺北市中山區吉林路10巷21號1樓,"02-25219494",L,M,K,M,L,M,L,M,L,M
I,8536,6100,"80038154",上鶴興業股份有限公司,新北市,新北市汐止區康寧街三三八號六樓,"02-2695-9566",L,M,L,M,L,M,L,M,L,M
I,8536,6101,"89324642",高島實業有限公司,新北市,新北市三重區自強路４段３１巷１２號４樓,"02-22872401",L,M,L,M,L,M,L,M,L,M
I,8536,6102,"27920851",上泓科技股份有限公司,台中市,台中市北屯區中清路７４巷８弄５之１號１樓,"0910566795",L,M,L,M,L,M,L,M,L,M
I,8536,6103,"51074905",三櫻企業股份有限公司,台中巿,台中巿梧棲區草湳里經三路４７號,"04-26595188",K,L,J,L,I,L,I,K,J,K
